,Judul,Isi
37,Jadwal SIM Keliling di Bekasi Bulan November 2023,"KOMPAS.com - Layanan perpanjangan Surat Izin Mengemudi (SIM) lebih praktis lewat SIM Keliling dibandingkan datang ke polres.Lokasi layanan SIM keliling berpindah-pindah sehingga harus mengetahui jadwal dan lokasi pastinya. Layanan SIM keliling ini biasanya diadakan di dalam mobil yang bertuliskan SIM keliling.Untuk tanggal merah atau libur nasional layanan SIM keliling tidak beroperasi. Sementara itu melansir dari keterang di instagram resmi Polres Metro Bekasi, untuk kesehataan & psikologi disediakan ditempat.Adapun biaya perpanjangan SIM sesuai dengan PP Nomor 60 Tahun 2016 tentang Penerimaan Negara Bukan Pajak adalah sebesar Rp 80.000 untuk perpanjangan SIM A dan Rp 75.000 untuk perpanjangan SIM C.Berikut ini informasi mengenai lokasi SIM keliling di Bekasi bulan November 2023:Lokasi SIM KelilingMitra 10 Harapan IndahLokasi: Jalan Harapan Indah Boulevard, Kecamatan Medan Satria,Jadwal: Setiap Senin pukul 08.00-10.00 WIBPolsek Bantar GebangLokasi: Jalan Siliwangi No.Km.10, BantargebangJadwal: Setiap Selasa pukul 08.00-10.00 WIBMetropolitan Mall BekasiLokasi: Jalan K.H Noer Ali, Pekayon Jaya, Bekasi Jadwal: Setiap Rabu pukul 08.00-10.00 WIBBekasi Cyber ParkLokasi: Jalan KH Noer AliJadwal: Setiap Kamis pukul 08.00-10.00 WIBMitra10 JatimakmurLokasi: Jalan Raya Jati Makmur Nomor 115, Jatimakmur,Jadwal: Setiap Jumat pukul 08.00-10.00 WIBKantor Kecamatan Bekasi BaratLokasi: Jalan Bintara Nomor 4, BintaraJadwal: Setiap Sabtu pukul 08.00-10.00 WIBPersyaratan yang perlu dibawaFotokopi KTPSIM asliTes Psikologi SIMSurat Keterangan SehatDapatkan update berita pilihan dan breaking news setiap hari dari Kompas.com. Mari bergabung di Grup Telegram ""Kompas.com News Update"", caranya klik link https://t.me/kompascomupdate, kemudian join. Anda harus install aplikasi Telegram terlebih dulu di ponsel. "
38,"Jokowi ""Groundbreaking"" Nusantara Intercultural School, Sekolah Internasional Pertama di IKN","JAKARTA, KOMPAS.com - Presiden Joko Widodo (Jokowi) melakukan peletakan batu pertama (groundbreaking) pembangunan Nusantara Intercultural School (NIS) di kawasan Ibu Kota Negara (IKN) Nusantara, Kalimantan Timur, Rabu (1/11/2023).NIS merupakan bagian dari Jakarta Intercultural School (JIS) dan akan menjadi sekolah bertaraf internasional pertama di IKN.""Kehadiran NIS di IKN menunjukkan keseriusan komitmen kita untuk menyediakan berbagai fasilitas pendukung ibu kota, termasuk menghadirkan lembaga pendidikan bertaraf internasional dan berkualitas dunia,"" ujar Jokowi dilansir siaran pers Sekretariat Presiden, Rabu.Mantan Gubernur DKI Jakarta ini berharap NIS nantinya dapat menyelenggarakan pendidikan berkelas dunia bagi anak-anak di IKN.Baca juga: Undang Khusus Ridwan Kamil ke IKN, Jokowi: Untuk Koreksi Terkait ArsitekturSelain itu, NIS diharapkan mampu menjadi salah satu pilihan sekolah dengan pendidikan yang bermutu di IKN.""Mempromosikan pendidikan global berkelas tinggi di Nusantara, dan memberikan pilihan pendidikan yang bermutu bagi warga IKN yang berasal dari berbagai daerah, berbagai negara, dan berbagai latar belakang,"" kata Jokowi.Pada kesempatan tersebut, Kepala Negara juga menceritakan sejumlah keresahan orang tua terkait pendidikan anak di Kota Nusantara.Untuk itu, Jokowi mengapresiasi komitmen JIS untuk menjawab keresahan para orang tua dengan membangun NIS.Baca juga: IKN Segera Punya Sekolah Bertaraf Internasional PertamaDiketahui, Presiden Jokowi juga melakukan groundbreaking proyek revitalisasi Sekolah Dasar Negeri 020 Sepaku, Kabupaten Penajam Paser Utara, Provinsi Kalimantan Timur pada hari Rabu ini.Dalam sambutannya, Presiden mengungkapkan rasa senang atas revitalisasi sekolah karena diyakini dapat meningkatkan kualitas pendidikan di sana.Apalagi, menurut Jokowi, revitalisasi tersebut nantinya juga didukung dengan sarana dan prasarana yang lengkap.""Ada ruang kelas, ada laboratorium IPA dan TIK, ada perpustakaan, ada kelas amphitheater, ada kantin, ada tempat baca, ada lapangan multifungsi, ada area hijau, ada konservasi embung, dan fasilitas pendukung lainnya,"" kata Jokowi.Baca juga: Minta Investasi Luar Negeri di IKN Direm Dulu, Jokowi: Dahulukan Investor Dalam NegeriLebih lanjut, Presiden menuturkan bahwa peningkatan kualitas pendidikan di sekitar kawasan IKN tidak hanya dilakukan di SDN 020 Sepaku.Ia menegaskan bahwa peningkatan kualitas tersebut juga akan dilakukan pada lima sekolah dasar lainnya.""Sehingga, nanti anak-anak kita semuanya bisa memiliki kualitas pendidikan yang baik dengan sarana-prasarana yang kualitasnya juga baik,"" ujar Jokowi.Baca juga: Jokowi Resmikan Pembangunan RS Hermina di IKN, Investasi Capai Rp 650 MiliarDapatkan update berita pilihan dan breaking news setiap hari dari Kompas.com. Mari bergabung di Grup Telegram ""Kompas.com News Update"", caranya klik link https://t.me/kompascomupdate, kemudian join. Anda harus install aplikasi Telegram terlebih dulu di ponsel. "
39,Kemenag Sudah Susun Data Jemaah Calon Haji Berangkat 2024,"JAKARTA, KOMPAS.com - Nama-nama jemaah calon haji yang akan berangkat pada 1445 hijriah atau pada 2024 sudah disusun Direktorat Jenderal Penyelenggaraan Haji dan Umrah Kementerian Agama.Dirjen Penyelenggaraan Haji dan Umrah Kemenag Hilman Latief berharap, mereka yang masuk dalam daftar untuk mempersiapkan diri.""Jika termasuk yang akan berangkat 2024, jemaah diimbau untuk mulai menjaga kesehatan. Jaga kesehatan dari aspek mendasar, mulai dari menjaga makanan dan olahraga,"" ujar Dirjen Penyelenggaraan Haji dan Umrah (PHU) Kemenag Hilman Latief di Jakarta, Rabu (1/11/2023), dikutip dari Antara.Baca juga: Jokowi Umumkan Indonesia Dapat 20.000 Kuota Haji Tambahan untuk 2024Hilman mengatakan, data jemaah yang akan berangkat itu akan disampaikan ke Kantor Wilayah (Kanwil) Kemenag provinsi agar menjadi panduan.Jemaah juga sudah bisa melihat perkiraan keberangkatannya melalui Sistem Komputerisasi Haji Terpadu (Siskohat).Jemaah calon haji yang masuk dalam daftar berangkat melakukan tes pemeriksaan kesehatan.Adapun untuk biaya dan lokasi masih akan didiskusikan dengan Kementerian Kesehatan (Kemenkes) dan BPJS Kesehatan.Tes kesehatan ini menjadi salah satu syarat pelunasan Biaya Perjalanan Ibadah Haji (Bipih).Pasalnya Kemenag akan menerapkan syarat istithaah kesehatan yakni jemaah yang benar-benar sehat secara fisik dan mental yang diutamakan berangkat.Baca juga: Diminta Jokowi, Arab Saudi Kabulkan Penambahan Kuota Haji Indonesia 20.000 Jemaah""Kami juga akan segera sampaikan ke publik, di mana saja dan berapa biaya yang dikeluarkan jemaah saat pemeriksaan kesehatan. Kami akan sampaikan ke publik bahwa pemeriksaan sudah bisa dilakukan,"" kata Hilman.Sementara itu Direktur Bina Haji Kemenag Arsad Hidayat mengatakan istithaah kesehatan akan menjadi perhatian bersama, pemerintah, jemaah, dan juga masyarakat.Kemenag dan Kemenkes secara berjenjang akan memberikan edukasi dan sosialisasi tentang istithaah kesehatan haji kepada calon peserta haji melalui penyuluhan kesehatan serta bimbingan manasik haji dan melibatkan peran serta masyarakat/KBIHU (Kelompok Bimbingan Ibadah Haji dan Umrah) dan ormas Islam.Dapatkan update berita pilihan dan breaking news setiap hari dari Kompas.com. Mari bergabung di Grup Telegram ""Kompas.com News Update"", caranya klik link https://t.me/kompascomupdate, kemudian join. Anda harus install aplikasi Telegram terlebih dulu di ponsel. "
40,"Prabowo-Gibran Tak Janjikan Penyelesaian Kasus HAM Masa Lalu, Aktivis HAM Singgung soal Rekam Jejak","JAKARTA, KOMPAS.com - Aktivis Hak Asasi Manusia (HAM) Usman Hamid menyinggung soal rekam jejak para bakal calon presiden dan calon wakil presiden (capres-cawapres), khususnya Prabowo Subianto dan Gibran Rakabuming Raka yang tak mencantumkan program penyelesaian kasus hak asasi manusia (HAM) masa lalu.Usman Hamid mengatakan, penting untuk melihat kiprah para bakal capres-cawapres selama menjadi pejabat dan politikus.""Adakah dari mereka yang selama ini terlihat gigih memperjuangkan penyelesaian kasus-kasus HAM berat masa lalu atau malah berdiam diri atas terjadinya pelanggaran HAM atau malah justru terlibat dalam pelanggaran-pelanggaran HAM berat masa lalu?"" ujar Usman melalui pesan singkat, Rabu (1/11/2023).Menurutnya, rekam jejak tersebut penting ditelaah karena kasus pelanggaran HAM khususnya pelanggaran HAM berat masa lalu harus dituntaskan.Baca juga: Hanya Prabowo-Gibran yang Tak Janjikan Penyelesaian Pelanggaran HAM Masa LaluSekretaris Tim Pencari Fakta (TPF) kasus pembunuhan Munir ini mengatakan, penuntasan kasus HAM harus dilakukan secara hukum untuk memberikan keadilan bagi para korban yang kehilangan haknya di masa lalu.""Hal itu juga penting karena menyangkut moralitas kolektif masyarakat bangsa di masa depan. Bangsa ini memerlukan masa depan baru, dalam arti berpijak pada sejarah pelanggaran HAM masa lalu yang jujur mengakui sisi kelamnya. Hal ini pula yang bisa mencegah pelanggaran HAM berat terulang di masa depan,"" kata Usman Hamid.Direktur Eksekutif Amnesty Internasional Indonesia ini juga menyebut bahwa kasus pelanggaran HAM sangat mungkin terjadi berulang.""Maka ini yang harus dituntut oleh para capres dan cawapres, apa komitmen-komitmen spesifik mereka untuk menjamin agar pelanggaran HAM masa lalu tidak terulang di masa depan. Itu yang menjadi kunci,"" ujar Usman.Baca juga: Visi Misi 3 Pasangan Bacapres-Bacawapres Terkait Penegakan HAMSebagai informasi, hanya pasangan bakal capres-cawapres Prabowo Subianto dan Gibran Rakabuming Raka yang tidak mencantumkan program penyelesaian kasus HAM dalam visi-misinya.Dalam misi terkait HAM, Prabowo-Gibran hanya menjanjikan perlindungan HAM untuk warga negara dan menghapus praktik diskriminasi.Keduanya juga membuat program kebijakan inklusif, menjamin pemenuhan hak dasar masyarakat dan kelompok rentan hingga perlindungan untuk tenaga kerja.Sedangkan pasangan calon lainnya, Ganjar Pranowo dan Mahfud MD, berkomitmen menyelesaikan pelanggaran HAM masa lalu secara adil. Terutama, terhadap pelanggaran HAM yang jadi beban peradaban bangsa.Pasangan calon dari Koalisi Perubahan untuk Persatuan (KPP) Anies Baswedan dan Muhaimin Iskandar (Cak Imin) juga berkomitmen menuntaskan kasus pelanggaran HAM dalam visi misinya.Tidak hanya itu, Anies-Cak Imin ini juga mendorong pemulihan sosial ekonomi korban pelanggaran HAM dan menguatkan lembaga HAM Nasional.Baca juga: Anies-Cak Imim Janji Tuntaskan Kasus Pelanggaran HAMDapatkan update berita pilihan dan breaking news setiap hari dari Kompas.com. Mari bergabung di Grup Telegram ""Kompas.com News Update"", caranya klik link https://t.me/kompascomupdate, kemudian join. Anda harus install aplikasi Telegram terlebih dulu di ponsel. "
41,Gerindra Sebut Putusan MK soal Usia Capres-Cawapres Tak Terkait Kepentingan Keluarga,"JAKARTA, KOMPAS.com - Partai Gerindra mempertanyakan alasan digunakan buat mempersoalkan putusan Mahkamah Konstitusi (MK) terkait syarat batas usia capres-cawapres karena dianggap sarat konflik kepentingan.“Putusan Mahkamah Konstitusi ini enggak ada konflik kepentingan, kepentingan keluarga atau kepentingan nasional, karena dengan bisa majunya anak muda tidak menghalangi pihak manapun untuk maju juga,"" kata Wakil Ketua Umum Partai Gerindra Habiburokhman seperti dikutip dari program Sapa Indonesia Pagi di Kompas TV, Rabu (1/11/2023).""Apakah ada pihak yang takut dengan majunya anak muda, sedemikian takutnya sehingga kalau anak muda maju bisa dianggap mengganggu kepentingan nasional. Logikanya dari mana?"" ujar Habiburokhman.Habiburokhman menilai wajar terjadi perbedaan pandangan dalam memaknai setiap putusan MK. Akan tetapi, kata dia, Gerindra tetap menghormati seluruh pendapat.Baca juga: Wacanakan Hak Angket terhadap MK, Masinton: Konstitusi Kita Sedang Diinjak-injak!Dia berharap pihak-pihak yang merasa kepentingan politiknya terusik akibat putusan MK itu sebaiknya tidak melanjutkan narasi delegitimasi karena justru bisa memperkeruh masalah.""Sehingga enggak akan putus kalau kita terus memperdebatkan sesuatu yang sudah final, sudah mengikat,"" ucap Habiburokhman.Menurut Habiburokhman, jika seluruh kalangan tidak menaati putusan lembaga yudikatif karena dianggap bertentangan dengan kepentingan politik, maka hal itu sama saja tidak taat terhadap prinsip demokrasi.""Ini bentuk konsistensi kita, komitmen kita pada demokrasi. Demokrasi itu adalah bagaimana kita menaati hukum. Bahwa kita selain negara demokrasi adalah negara hukum,"" ucap Habiburokhman.Baca juga: Politisi PDI-P Masinton Akan Kumpulkan Dukungan Dewan untuk Usul Hak Angket MKSedangkan Gibran berhasil menduduki posisi Wali Kota Solo atas dukungan Partai Demokrasi Indonesia Perjuangan (PDI-P).Sebelumnya diberitakan, Anggota Komisi XI DPR Fraksi PDI-P Masinton Pasaribu mengatakan dirinya akan menggulirkan wacana hak angket terhadap Mahkamah Konstitusi (MK) terkait putusan MK mengenai batas usia capres-cawapres.Hal tersebut Masinton sampaikan ketika sedang melakukan interupsi di Rapat Paripurna DPR, Selasa (31/10/2023).Masinton menjelaskan, konstitusi harus tegak dan tidak boleh dipermainkan atas nama pragmatis politik sempit.Dia mengklaim dirinya menyuarakan hal tersebut bukan demi kepentingan PDI-P ataupun capres manapun.Baca juga: Gerindra: Putusan MK Tak Bisa Jadi Obyek Hak Angket DPR Masinton mengatakan putusan MK itu merupakan ancaman terhadap konstitusi.Apalagi, kata dia, Reformasi 1998 jelas memandatkan Indonesia harus bebas dari korupsi, kolusi, dan nepotisme (KKN). "
42,"Jokowi Resmikan Pembangunan RS Hermina di IKN, Investasi Capai Rp 650 Miliar","JAKARTA, KOMPAS.com - Presiden Joko Widodo melakukan peletakan batu pertama atau groundbreaking Rumah Sakit (RS) Hermina Nusantara di kawasan Ibu Kota Nusantara (IKN), Kalimantan Timur, pada Rabu (1/11/2023).Presiden yakin kehadiran RS tersebut akan meningkatkan kepercayaan masyarakat dan investor untuk tinggal dan berinvestasi di IKN.""Groundbreaking rumah sakit ini akan makin menguatkan kepercayaan masyarakat dan investor agar tidak ragu-ragu lagi untuk tinggal di IKN, tidak ragu-ragu berinvestasi dan mengembangkan usahanya di IKN Nusantara,"" ujar Jokowi dilansir siaran pers Sekretariat Presiden, Rabu.Baca juga: Groundbreaking Sekolah Internasional Pertama di IKN, Jokowi: Yang Mau Pindah, Jangan Ragu-ragu LagiMenurut Jokowi, ketersediaan fasilitas kesehatan yang baik merupakan hal pertama yang selalu ditanyakan masyarakat yang ingin menjadi warga IKN.Oleh karenanya, kehadiran berbagai RS bertaraf internasional di kawasan IKN diharapkan dapat menjawab kekhawatiran masyarakat tersebut.Lebih lanjut, mantan Gubernur DKI itu menuturkan bahwa investasi yang dikucurkan untuk pembangunan RS Hermina Nusantara mencapai Rp 650 miliar.Kepala Negara pun berharap pembangunan RS tersebut dapat segera selesai sehingga masyarakat IKN dan sekitarnya bisa mendapatkan pelayanan kesehatan yang unggul.Jokowi menjelaskan, dengan adanya RS Hermina Nusantara ini masyarakat di IKN dan sekitarnya bisa mendapatkan pelayanan kesehatan yang unggul seperti pelayanan gawat darurat, trauma center dan ortopedi, pelayanan ibu dan anak, perinatologi, tumbuh kembang anak, dan neurologi.Baca juga: Undang Khusus Ridwan Kamil ke IKN, Jokowi: Untuk Koreksi Terkait Arsitektur""Tadi juga disampaikan oleh dr. Hasmoro (Presiden Direktur RS Hermina) bahwa ini tidak hanya melayani pasien VVIP tetapi juga pasien BPJS dan non-BPJS, ini sangat bagus,"" ungkap Jokowi.Adapun RS Hermina merupakan fasilitas kesehatan ketiga yang rencananya dibangun di IKN.Sebelumnya, Presiden Jokowi sudah melakukan groundbreaking pembangunan RS Mayapada dan RS Abdi Waluyo di kawasan tersebut. Dapatkan update berita pilihan dan breaking news setiap hari dari Kompas.com. Mari bergabung di Grup Telegram ""Kompas.com News Update"", caranya klik link https://t.me/kompascomupdate, kemudian join. Anda harus install aplikasi Telegram terlebih dulu di ponsel. "
43,Gerindra Nilai Hak Angket MK Bentuk Pembangkangan Putusan Yudikatif,"JAKARTA, KOMPAS.com - Partai Gerindra menilai wacana mengajukan hak angket terhadap putusan Mahkamah Konstitusi terkait syarat batas usia capres-cawapres merupakan bentuk pembangkangan terhadap putusan lembaga yudikatif.""Bentuk pembangkangan terhadap putusan pengadilan, apalagi Mahkamah Konstitusi adalah produk Reformasi, itu adalah pembangkangan terhadap konstitusi dan demokrasi,"" kata Wakil Ketua Umum Partai Gerindra Habiburokhman seperti dikutip dari program Sapa Indonesia Pagi di Kompas TV, Rabu (1/11/2023).Habiburokhman menilai wajar terjadi perbedaan pandangan dalam memaknai setiap putusan MK. Akan tetapi, kata dia, Gerindra tetap menghormati seluruh pendapat.Dia berharap pihak-pihak yang merasa kepentingan politiknya terusik akibat putusan MK itu sebaiknya tidak melanjutkan narasi delegitimasi karena dianggap bisa memperkeruh masalah.Baca juga: Wacanakan Hak Angket terhadap MK, Masinton: Konstitusi Kita Sedang Diinjak-injak!""Sehingga enggak akan putus kalau kita terus memperdebatkan sesuatu yang sudah final, sudah mengikat,"" ucap Habiburokhman.Menurut Habiburokhman, jika seluruh kalangan tidak menaati putusan lembaga yudikatif karena dianggap bertentangan dengan kepentingan politik, maka hal itu sama saja tidak taat terhadap prinsip demokrasi.""Ini bentuk konsistensi kita, komitmen kita pada demokrasi. Demokrasi itu adalah bagaimana kita menaati hukum. Bahwa kita selain negara demokrasi adalah negara hukum,"" ucap Habiburokhman.Sedangkan Gibran berhasil menduduki posisi Wali Kota Solo atas dukungan Partai Demokrasi Indonesia Perjuangan (PDI-P).Baca juga: Politisi PDI-P Masinton Akan Kumpulkan Dukungan Dewan untuk Usul Hak Angket MKSebelumnya diberitakan, Anggota Komisi XI DPR Fraksi PDI-P Masinton Pasaribu mengatakan dirinya akan menggulirkan wacana hak angket terhadap Mahkamah Konstitusi (MK) terkait putusan MK mengenai batas usia capres-cawapres.Hal tersebut Masinton sampaikan ketika sedang melakukan interupsi di Rapat Paripurna DPR, Selasa (31/10/2023).Masinton menjelaskan, konstitusi harus tegak dan tidak boleh dipermainkan atas nama pragmatis politik sempit.Baca juga: Gerindra: Putusan MK Tak Bisa Jadi Obyek Hak Angket DPR Dia mengklaim dirinya menyuarakan hal tersebut bukan demi kepentingan PDI-P ataupun capres manapun.Masinton mengatakan putusan MK itu merupakan ancaman terhadap konstitusi.Apalagi, kata dia, Reformasi 1998 jelas memandatkan Indonesia harus bebas dari korupsi, kolusi, dan nepotisme (KKN).""Maka kita harus mengajak secara sadar dan kita harus sadarkan bahwa konstitusi kita sedang diinjak-injak. Kita harus menggunakan hak konstitusional yang dimiliki oleh lembaga DPE. Saya Masinton Pasaribu anggota DPR RI dari daerah pemilihan DKI Jakarta menggunakan hak konstitusi saya untuk melakukan hak angket,"" imbuhnya sembari berteriak karena mikroponnya dimatikan. "
44,Pelajar yang Dicabuli Kakek di Jaksel Jalani Pemeriksaan Psikologi,"JAKARTA, KOMPAS.com - Pelajar berinisial S (14), yang merupakan korban pencabulan kakeknya sendiri, SS (55), menjalani pemeriksaan psikologi. Wakasat Reskrim Polres Metro Jakarta Selatan Kompol Henrikus Yossi menyebut, pemeriksaan psikologi dilakukan oleh Unit Pelayanan Terpadu Pemberdayaan Perempuan dan Anak (UPT P3A) Jakarta Selatan.  ""Kami merujuk korban ke UPT P3A Jakarta Selatan untuk pemeriksaan psikologi,"" ujar dia saat dikonfirmasi, Rabu (1/11/2023). Tak hanya pemeriksaan psikologi, Yossi menyebut S sebelumnya telah menjalani visum lebih dulu. Visum dilakukan untuk memeriksa kondisi awal korban, baik fisik maupun psikis. Baca juga: Polisi Panggil Ayah Korban dan Ahli untuk Dalami Kasus Kakek Cabuli Pelajar di Jaksel ""Kami juga telah merujuk korban untuk visum ke Rumah Sakit Cipto Mangunkusumo (RSCM),"" kata dia. Sebelumnya, penyidik telah memeriksa delapan saksi dalam kasus ini. Beberapa saksi yang diperiksa antara lain pelapor, terlapor, dan korban. ""Kami sudah memeriksa beberapa saksi dalam kasus ini. Mulai dari korban, pelapor, terlapor, dan lima saksi lainnya,"" tutur Yossi. Namun, Yossi menemukan adanya perbedaan keterangan yang disampaikan para saksi. Oleh karena itu, pihaknya berencana melakukan konfrontir guna menemukan fakta yang sebenarnya.  ""Dikarenakan ada perbedaan keterangan diantara para saksi, maka kami berencana melakukan pemeriksaan konfrontir terhadap pada saksi,"" imbuh dia  Sebagai informasi, S diduga menjadi korban pencabulan salah satu anggota keluarganya.Achmad Rulyansyah, paman sekaligus kuasa hukum korban mengungkapkan korban telah dicabuli oleh adik kakeknya yang juga berinisial SS (55). ""Benar, korban telah dicabuli oleh adik kakeknya di kawasan Kebayoran Lama, Jakarta Selatan, 11 Februari 2023 lalu,"" ungkap dia. Achmad mengatakan, peristiwa itu terjadi ketika korban sedang menginap di rumah pelaku selama satu pekan. Pelaku disebut melancarkan aksi bejatnya ketika sang istri tengah pergi ke luar.Baca juga: Ada Beda Keterangan, Polisi akan Konfrontir Saksi dalam Kasus Dugaan Kakek Cabuli Pelajar di Jaksel SS kemudian melakukan bujuk rayu terhadap korban dengan menawarkan belanja online di media sosial. Namun, ada syarat yang harus dipenuhi korban bila ingin dibelikan sesuatu oleh pelaku. ""Jadi korban diminta untuk masuk ke kamar terlapor bila ingin dibelikan sesuatu. Setelah masuk ke kamar, terlapor kemudian merayu korban, 'Sini peluk kakek, sini cium kakek',"" kata Achmad. "
45,Gerindra Anggap yang Persoalkan Putusan MK Tak Taat Prinsip Demokrasi,"JAKARTA, KOMPAS.com - Partai Gerindra menilai jika ada pihak-pihak yang masih mempersoalkan putusan Mahkamah Konstitusi terkait syarat batas usia capres-cawapres sama saja tidak menaati prinsip demokrasi.""Ada budaya hukum kita kalau pengadilan sudah menghasilkan putusan, dan putusan itu mengikat, maka kita harus menghormatinya,"" kata Wakil Ketua Umum Partai Gerindra Habiburokhman seperti dikutip dari program Sapa Indonesia Pagi di Kompas TV, Rabu (1/11/2023).Menurut Habiburokhman, jika seluruh kalangan tidak menaati putusan lembaga yudikatif karena dianggap bertentangan dengan kepentingan politik, maka hal itu sama saja tidak taat terhadap prinsip demokrasi.""Ini bentuk konsistensi kita, komitmen kita pada demokrasi. Demokrasi itu adalah bagaimana kita menaati hukum. Bahwa kita selain negara demokrasi adalah negara hukum,"" ucap Habiburokhman.Baca juga: Wacanakan Hak Angket terhadap MK, Masinton: Konstitusi Kita Sedang Diinjak-injak!Habiburokhman menilai wajar terjadi perbedaan pandangan dalam memaknai setiap putusan MK. Akan tetapi, kata dia, Gerindra tetap menghormati seluruh pendapat.Dia berharap pihak-pihak yang merasa kepentingan politiknya terusik akibat putusan MK itu sebaiknya tidak melanjutkan narasi delegitimasi.“Tapi ada juga yang mengkritisi karena kepentingannya terganggu, karena keinginan berkuasanya syahwat kuasanya terganggu, ini yang munafik-munafik seperti ini kan juga mengkampanyekan terus, mendistorsi putusan Mahkamah Konstitusi,” ucap Habiburokhman.Di sisi lain, yang menjadi sorotan utama adalah putusan MK itu memberi jalan bagi Wali Kota Solo Gibran Rakabuming Raka, yang merupakan anak sulung Presiden Joko Widodo (Jokowi), menjadi peserta Pilpres 2024.Baca juga: Politisi PDI-P Masinton Akan Kumpulkan Dukungan Dewan untuk Usul Hak Angket MKGibran diusung dan didaftarkan ke Komisi Pemilihan Umum (KPU) sebagai bakal cawapres mendampingi bakal capres Prabowo Subianto.Sedangkan Gibran berhasil menduduki posisi Wali Kota Solo atas dukungan Partai Demokrasi Indonesia Perjuangan (PDI-P).“Ketika Mas Gibran maju jadi ribut, kalau Mas Gibran nggak maju, nggak ribut, ini jadi bukan masalah hukum, bukan persoalan kekuatiran terganggunya kepentingan nasional dan lain sebagainya,” kata Wakil Ketua Komisi III DPR itu.Sebelumnya diberitakan, Anggota Komisi XI DPR Fraksi PDI-P Masinton Pasaribu mengatakan dirinya akan menggulirkan wacana hak angket terhadap Mahkamah Konstitusi (MK) terkait putusan MK mengenai batas usia capres-cawapres.Baca juga: Gerindra: Putusan MK Tak Bisa Jadi Obyek Hak Angket DPR Hal tersebut Masinton sampaikan ketika sedang melakukan interupsi di Rapat Paripurna DPR, Selasa (31/10/2023).Masinton menjelaskan, konstitusi harus tegak dan tidak boleh dipermainkan atas nama pragmatis politik sempit.Dia mengklaim dirinya menyuarakan hal tersebut bukan demi kepentingan PDI-P ataupun capres manapun. "
