Dokumen,Topik 1,Topik 2,Topik 3,Topik 4,Topik 5,Topik 6,Label,Cluster
sistem informasi akademik siakad sistem informasi berfungsi menangani pengelolaan penyajian datadata akademik fakultas siakad dianggap pelayanan mahasiswa membutuhkan informasi akademik universitas trunojoyo tersedia siakad database terpusat sistem kelebihan perawatannya mudah membutuhkan biaya sistem berpotensi mengahadapi kendalakendala proses transaksi data padatnya jaringan database siakad kelambatan pemrosesan respon query data tersimpan pemrosesan kompleks memiliki kelemahan ketersediaan data sistem pengembangan sistem database sistem databases terdistribusi masingmasing fakultas dijadikan solusi permasalahan basisdata terdistribusi keuntungan dimiliki basisdata terpusat pengawasan distribusi reability availability kecepatan pemrosesan query otonomi local,0.0012110190071291653,0.0012107967192576876,0.0012108640033859494,0.0012108391002250455,0.9939455908658174,0.0012108903041847749,RPL,2
berjalannya koneksi jaringan komputer lancar gangguan harapan penggunanya bertanggung bidang administrator jaringan koneksi jaringan berjalan lancar gangguan kenyataan lapangan jaringan komputer skala berpotensi gangguan kerusakan koneksi jaringan komputer disebabkan banyaknya penggunaan padatnya traffic data jaringan komputer menjaga meningkatkan kualitas layanan koneksi jaringan akses kontrol monitoring level administrator jaringan realtime berbasis mobile mengatur informasi koneksi jaringan diakses administrator jaringan dituntut gangguan terputusnya koneksi jaringan administrator kontrol monitoring sistem kontrol monitoring berbasis mobile diharapkan membantu tugas administrator mengontrol memantau jaringan mengambil kebijakan node node terkoneksi jaringan memanajemen koneksi port bandwidth mobile pembenahan gangguan jaringan pemakai jaringan klien pengaduan gangguan kunci administrator jaringan koneksi jaringan akses kontrol monitoring,0.0009471200322367908,0.0009470844977646205,0.0009471558346709107,0.9952642199529301,0.0009472780440770713,0.000947141638320441,RPL,1
web server perangkat lunak server berfungsi menerima permintaan http https web client mengirimkan bentuk halamanhalaman web berbentuk dokumen html dokumen html dikirim dokumen dibentuk bahasa markup plaintext dokumen berisi kodekode html murni proses enkripsi tujuan penelitan aplikasi proxy server menerima permintaan http web client meneruskannya web server aplikasi menerima respon server proses enkripsi dokumen html dokumen html dikirim web client berbentuk dokumen html terenkripsi web client aplikasi internet explorer mozilla firefox opera aplikasiaplikasi dikenal sebutan web browser web browser menerima dokumen html terenkripsi aplikasi proxy server javascript engine web browser proses dekripsi rendering dokumen ditampilkan sesuai aslinya kode dokumen html menu view source web browser didapatkan dokumen html terenkripsi,0.21489114906123935,0.14969762150177401,0.0009125660429412036,0.0009125211125537857,0.632673628832471,0.0009125134490207218,RPL,2
penjadwalan kuliah perguruan kompleks permasalahan variabel dipertimbangkan jadwal optimal penyusunan jadwal kuliah selayaknya dicoba menemukan penjadwalan terbaik dibutuhkan metode optimasi diterapkan penjadwalan mata kuliah metode menyelesaikan permasalahan algoritma genetika tugas bertujuan sistem jadwal matakuliah otomatis hasilnya optimal hasil penelitian algoritma genetika jadwal optimal dibuktikan nilai fitness memiliki nilai otomatis jadwal dibentuk optimal semoga aplikasi diharapkan mempermudah didalam pembuatan penjadwalan matakuliah mudah cepat kunci algoritma genetika optimasi penjadwalan,0.0014794684846113674,0.0014794335213694737,0.9926026364192867,0.0014794257621725552,0.0014795415453794235,0.0014794942671805748,RPL,0
seiring perkembangan teknologi didunia muncul teknologi augmented reality augmented reality ar upaya menggabungkan dunia maya dunia virtual komputer batas tipis headmounted display hmd contoh hasil penelitian augmented reality satusatunya peralatan dasar teknologiteknologi terbaru seiring berjalannya augmented reality berkembang pesat pengembangan aplikasi bidang mengembangkan ar library pendukung flartoolkit salah satunya flartoolkit library pendukung augmented reality platform flash berdasarkan sistem ar animasi benda bergerak animasi bergerak permainan pingpong dimana dikolaborasikan augmented reality menggerakkan langkah playernya interaksi obyek gerak bola dipukul obyek virtual ditampilkan augmented reality,0.0011963095899764087,0.0011963773539596509,0.001196605087798397,0.001196372521381588,0.994018081386083,0.0011962540608008738,KOMPUTASI,2
gerak pekerja game memiliki genre rts realtime strategy gerak pekerja memiliki gerak dibutuhkan pendekatan konsep ai mendesain perilaku pekerja perilaku karakter ditambahi ai artifical intelegent perilakunya hidup realistis penelitian ai finite state machine finite state machine menentukan gerak pekerja parameterparameter dasar gerak disimulasikan game rts game engine hasil peroleh penelitian penerapan metode finite state machine menentukan gerak pekerja berdasarkan parameter harta prajurit kondisi bangunan stockpile resources bawa kunci game realtime strategy gerak pekerja finite state machine,0.0013057933276985182,0.9934710642160869,0.0013059352090469302,0.0013056650637196464,0.0013057962511763698,0.0013057459322715172,KOMPUTASI,1
perkembangan game pesat alternative peminatnya bentuk game cerita media penyajian keberadaan game menggambarkan budaya indonesia daerah kepulauan madura terhitung dirasa lunturnya kebudayaan indonesia anak bangsa peminat game sarana pengenalan budaya asli madura aplikasi game olahraga digemari pulau madura kerapan sapi dibangun aplikasi game kerapan sapi upaya pelestarian budaya bangsa pulau madura upaya pembuatan game budaya dibangun game perawatan sapi karapan metode logika fuzzy fuzzy logic menginputkan parameter kekuatan kesehatan sapi karapan menentukan harga jual sapi karapan game perawatan sapi karapan kunci game kerapan sapi perawatan sapi kerapan budaya madura,0.001116194592721498,0.5429947461676154,0.0011162948173187174,0.45254013788740016,0.0011163313227537932,0.0011162952121903718,KOMPUTASI,1
sistem pengenalan wajah sistem mengenali identitas wajah manusia teknologi mengidentifikasi tubuh manusia unik wajah manusia khusus bidang identifikasi pengenalan wajah manusia memanfaatkan pengolahan analisis citra wajah berperan proses pengenalan wajah manusia sistem manfaatkan sistem keamanan bidang biometrika penelitian bangun perangkat lunak pengenalan citra wajah manusia metode two dimensional linear discriminant analysis dlda menentukan karakteristik wajah manusia tahap pengklasifikasian metode angular separation mengukur kemiripan data pelatihan training data uji coba testing proses testing gambar wajah ketahui identitas uji coba aplikasi klasifikasi angular separation peroleh akurasi pengenalan pose citra wajah pelatihan pose citra wajah uji coba testing data ratus citra wajah manusia ambil database orl sepuluh eigen kunci sistem pengenalan wajah two dimensional linear discriminant analysis angular separation,0.9957113122885562,0.0008577267129103173,0.0008577432860770806,0.0008576947964100969,0.0008578088605069574,0.0008577140555392131,RPL,1
teknologi mobile game beroperating system open source berkembang pesat keragaman variasinya mobile game memiliki peminat kalangan dasar pengembang mengembangkan mobile game penelitian mobile game mengasah kemampuan berfikir dikembangkan mengimplementasikan algoritma prim depth first search pembuatannya algoritma prim diterapkan pembuatan lintasan maze algoritma depth first search diterapkan proses pencarian solusinya hasil pengujian disimpulkan algoritma prim depth first search berfungsi resolusi screen x pixels pembentukan lintasan pencarian solusi maze kunci mobile game android algoritma prim algoritma depth first search,0.001305805864735531,0.001305763303501434,0.9934711973741747,0.0013056510975505203,0.0013058461796650335,0.0013057361803726832,RPL,0
kantor badan kepegawaian kota bangkalan instansi pemerintahan bergerak bidang pelayanan kepegawaian meningkatkan kualitas pelayanan sistem informasi memonitoring membantu proses kinerja dinas penelitian dibahas menerapkan architecture enterprise bkd bangkalan menggunakkan metode togaf adm mengimplementa sikannya kedalam implementasi aplikasi enterprise dibentuk keterpaduan egovernment bangkalan togaf adm memiliki komponen utama arsitektur bisnis arsitektur data arsitektur teknologi arsitektur aplikasi intinya togaf architecture enterprise aspek penelitian dibahas perancangan sistem arsitektur sistem informasi bkd bangkalan subsistem egovernment bangkalan togaf adm tujuannya menghasilkan sistem aplikasi administrasi kantor badan kepegawaian daerah bangkalan blue print memperbaiki efisiensi kenyamanan aksesibilitas pelayanan publik kunci arsitektur interprise togaf adm arsitektur bisnis arsitektur data arsitektur aplikasi arsitektur teknologi,0.4014308104791912,0.0009470426246222753,0.0009471076108097334,0.0009470832154193027,0.5947808846084249,0.0009470714615325838,RPL,2
penyusunan sistem informasi dinas perindustrian perdagangan disperindag kabupaten bangkalan meningkatkan kualitas pelayanan membantu proses kinerja dinas salah faktor pendorong pemanfaatan sistem informasi meningkatnya kebutuhan fungsi pelayanan dijalankan tujuan penerapan arsitektur enterprise menciptakan keselarasan bisnis teknologi informasi kebutuhan instansi penerapan arsitektur enterprise terlepas instansi merencanakan merancang arsitektur enterprise togaf adm metodologi lengkap instansi memahami tahapan tahapan metodologi diterjemahkan aktivitas perancangan arsitektur enterprise tahapan perancangan arsitektur enterprise berlanjut tahapan rencana implementasi togaf adm memiliki komponen utama arsitektur bisnis arsitektur data arsitektur teknologi arsitektur aplikasi intinya togaf arsitektur enterprise aspek menghasilkan model kerangka dasar mengembangkan sistem informasi terintegrasi mendukung kebutuhan dinas perindustrian perdagangan sesuai peraturan bupati bangkalan nomor uraian tugas jabatan struktural dinas perindustrian perdagangan,0.31843270288362774,0.0008881722362582355,0.0008882240072001811,0.000888333983888211,0.6780143040737262,0.0008882628152993667,RPL,2
perusahaan pemerintah swasta tujuan dicapai pencapaian tujuan perusahaan pemanfaatan sumber daya dimiliki optimal salah sumber daya sumber daya manusia dimiliki perusahaan sesuai peraturan ditetapkan pt surya madistrindo pamekasan proses promosi jabatan kriteriakriteria aspek kapasitas intelektual aspek sikap kerja aspek perilaku masingmasing sub kriteria tersendiri metode metode fuzzy analytic network process fanp metode fanp mencari bobot prioritas kepentingan kriteria sub kriteria ditetapkan proses perangkingan bobot kriteria masingmasing data karyawan pembobotan diperoleh hasil kuesioner pimpinan perusahaan proses perangkingan mengalikan nilai bobot kriteria tiaptiap sub kriteria menyeleksi karyawan berhak menduduki jabatan tersedia berdasarkan kriteriakriteria ditentukan hasil uji coba menyelesaikan studi proses promosi jabatan karyawan menghasilkan nilai akurasi kunci sistem pendukung keputusan promosi jabatan fuzzy analytic network process fanp,0.0008651837909291113,0.0008651723560236173,0.6162022810848077,0.0008651902647960553,0.3803370128848589,0.0008651596185845811,RPL,0
pelayanan makanan pasien rawat inap rumah sakit tujuan menu diet sesuai syarat gizi minimal sesuai penyakit diderita pasien menu disediakan rumah sakit memperhatikan kebutuhan kalori pasiennya individu mengakibatkan penyediaan makanan pasien sesuai kebutuhan kalori perhari pasien dibuatlah sistem pendukung keputusan rekomendasi menu diet pasien alat bantu penyediaan menu makanan pasien metode metode harris benedict perhitungan total kalori pasien metode euclidean perankingannya diharapkan aplikasi sistem pendukung keputusan merekomendasikan menu diet pasien beserta penjelasan kebutuhan kalori perhari asupan makanan perhari makanan dibatasi kunci sistem pendukung keputusan harris benedict euclidean,0.0011418947985729969,0.0011416064134619642,0.09482381862288738,0.0011416335741531412,0.9006090432726254,0.0011420033182990576,RPL,2
penyusunan sistem pendukung keputusan pemilihan teknik rekayasa kebutuhan membantu pengembang perangkat lunak membangun proyek perangkat lunak pemilihan teknik rekayasa kebutuhan berdasarkan pilihan system analis bersangkutan berdasarkan karakteristik teknik rekayasa kebutuhan sesuai proyek perangkat lunak menghasilkan perangkat lunak proses evaluasi pemilihan teknik rekayasa kebutuhan salah tahap proyek pengembangan perangkat lunak didalam spk proses pemilihan teknik rekayasa kebutuhan kriteria atribut project pengembang perangkat lunak proses clustering metode self organizing map som parameter distance matrix menangani data multi dimensional euclidean canberra jenis distance matrix lazim tingkat akurasinya menangani data riil hasil diperoleh membandingkan hasil clustering metode som berbasis euclidean distance canberra distance matrix menghasilkan teknik rekayasa kebutuhan efisien obyektif sesuai karakteristik proyek perangkat lunak kunci sistem pendukung keputusan teknik rekayasa kebutuhan clustering self organizing map canberra distance matrix,0.19450024558361487,0.000796222124018856,0.28795397752644153,0.12952517789414716,0.3864280486200975,0.0007963282516801876,RPL,2
sidik jari salah karakteristik fisik manusia identifikasi manusia sidik jari karakteristik berubah kecuali luka rusak akibat kecelakaan sidik jari tindak kriminal pencurian kecurangan administrasi proses pendeteksian sidik jari memudahkan pihakpihak berwajib menangani proses pendeteksian lakukan program komputer tahap perhitungan penentuan titik kenal corepoint proses berperan proses identifikasi manusia menentukan corepoint titik sidik jari manual otomatis manual lakukan kasat mata otomatis tentukan sistem tugas menentukan corepoint sidik jari otomatis metode geometry of region technique grcitra tugas diperoleh database fvc fingerprintbitmaps hasil uji coba sistem terbaik deteksi corepoint sidik jari metode geometry of region technique gr m v proses normalisasi ukuran blok x pixel hasil akurasi sistem didapatkan kunci sidik jari corepoint geometry of region technique gr normalisasi,0.35394475291100425,0.6425334125663149,0.0008805302665028824,0.0008803736929285504,0.00088049009195673,0.0008804404712927154,KOMPUTASI,1
indonesia perkembangan gizi perhatian status gizinya mengontrol gizi dibutuhkan tubuh penelitian dirancang aplikasi sistem pendukung keputusan menentukan status gizi pasien solusi makanan pasien sesuai riwayat penyakit derita pasien sistem dirancang berbasis web memudahkan admin ahli gizi rumah sakit penentuan status gizi pasien diharapkan aplikasi efisien efektifitas kinerja metode penelitian nave bayes classifier nbc metode terbaru memprediksi probabilitasmetode nave bayes classifier proses penentuan perhitungan probabilitas status gizi dimana dicari nilai probabilitas terbesar kesimpulan penentuan status gizi metode diterapkan studi sistem penentuan status gizi pasien hasil akurasi terbesar kunci nave bayes classifier sistem pendukung keputusan status gizi web,0.001035514765685509,0.001035265161925126,0.48036240621198517,0.0010353025046679345,0.459443966770683,0.05708754458505321,RPL,0
pengenalan tulisan tangan topik penelitian populer peneliti usahausaha sistem pengenalan tulisan tangan otomatis teknik berbeda penelitian membahas pengembangan sistem pengenalan tulisan tangan offline pencirian lokal karakterkarakter tulisan tangan salah faktor penentu pengenalan tulisan tangan model bentuk tulisan tangan penulis dikenali penulis memiliki gaya menulis bentuk tulisan tangan berbeda metode pengenalan pola tulisan tangan penelitian modified direction feature mdf proses ekstraksi fitur learning vector quantization lvq proses klasifikasi proses ekstraksi fitur metode mdf penentuan arah garis posisi tiaptiap piksel proses pelatihan data metode learning vector quantization lvq metode menghasilkan bobot proses pengenalan citra huruf tulisan tangan uji coba sistem hasil terbaik pengenalan citra huruf tulisan tangan diperoleh data pelatihan citra data uji coba citra hasil akurasi sistem didapatkan kunci tulisan tangan modified direction feature learning vector quantization,0.925743651859089,0.0007900172390329508,0.07109635848412808,0.0007899313144890075,0.0007900576393456436,0.0007899834639153474,RPL,1
citra senyum salah fitur biometrik dijadikan bukti autentik sistem pengenalan pola pattern recognition komputerisasi identitas ciri pengenalan senyum diteliti kalangan salah bentuk penerapan pengenalan pola senyum senyum senyum dikenali komputer disimpan database menentukan pola senyuman manual otomatis manual kasat mata otomatis tentukan sistem tugas mengidentifikasi senyuman otomatis metode principal component analysis pca linier descriminant analysis lda dimana jenis senyuman tugas dibagi senyum manis senyum mengejek senyum dipaksakan senyum tertutup senyum terbuka penggunaan metode ekstraksi fitur efisien menentukan keberhasilan sistem pengenalan pola metode klasifikasi pengenalan pola euclidean distance manhattan distance hasil uji coba gambar data pelatihan didapatkan tingkat akurasi pca ordered hasil uji coba pca lda didapatkan tingkat akurasi ordered,0.9954373448949917,0.0009125002209836888,0.000912569921758946,0.000912498502712088,0.0009125586495600046,0.0009125278099937479,RPL,1
batik kerajinan memiliki nilai seni budaya indonesia batik indonesia beragam jenis tekstur batik warna batik pola batik mencerminkan usul daerah batik pencarian citra berbasis teks efektif penilaian subjektif pengguna merepresentasikan citra sistem menangani pencarian citra query citra sistem perolehan citra berbasis isi spci content based image retrieval cbir penelitian ciri tekstur proses pencarian kemiripan delapan kelas citra batik berbeda cirebon bali bangkalan pamekasan sumenep yogyakarta solo pekalongan objek perolehan citra berbasis isi sistem dibangun proses utamanya ekstraksi fitur tekstur metode gray level difference method gldm arah utama gldm menghitung perbedaan mutlak sepasang derajat keabuan terpisah jarak arah hasil ekstraksi fitur pengukuran jarak kemiripan metode euclidean distance uji coba aplikasi pengukuran kemiripan euclidean distance nilai threshold diperoleh akurasi presisi data pelatihan data uji coba citra ditampilkan,0.9960184020534858,0.000796264062250845,0.0007963121585737038,0.0007963454610077156,0.0007963497555456135,0.0007963265091363222,RPL,1
kebutuhan pencarian data internet cepat faktor pengguna layanan internet sistem informasi tugas simtak fakultas teknik universitas trunojoyo madura membutuhkan pencarian data cepat berdasarkan konteks sistem pencarian dipakai pencarian database dimana hasil pencarian sesuai konteks keywords diinputkan memiliki kebenaran sistem kecerdasan pengetahuan ditangkap diproses ontologi mendukung tugas ontologi spesifikasi konseptualisasi semantik web abstrak representasi world wide web www berbasiskan standar didefinisikan resource description framework rdf ontology web language owl ide dasarnya membawa web memiliki definisi link data efektif mencari otomasi integrasi reuse informasi aplikasi semantik web didefinisikan sekumpulan teknologi dimana komputer memahami arti informasi berdasarkan metadata informasi isi informasi judul pengarang modifikasi tanggal halaman web hak cipta halaman web semantik web pencarian tugas hasil berdasarkan persamaan makna keyword diinputkan user kunci mesin pencari semantic web tugas abstract,0.0007900617388562465,0.0007900088085933482,0.0007900497516863152,0.0007899728146688474,0.9690778136023219,0.027762093283873284,RPL,2
perusahaan memiliki data berkaitan kegiatan bisnis dijaga diamankan orang berhak mengaksesnya seringkali muncul aksi ilegal mencoba merusak server mencuri data perusahaan mengakibatkan kesalahan fatal kelancaran kegiatan bisnis perusahaan disebabkan data valid menyikapi sistem monitoring keamanan mengamankan server tindakan penyusupan intrusion prevention system ips solusi keamanan jaringan server tindakan penyusupan ips mengembangkan snort fungsi pendeteksi dikombinasikan iptables firewall pencegah penyusupan ips dilengkapi user interface base basic analysis and security engine manajemen rule memudahkan admin memonitor sistem keamanan tindakan penyusupan jaringan server snort alert terdeteksi serangan disimpan log snort memerintahkan iptables drop alamat penyerang detail serangan tampilan user interface base hasil pengujian didapatkan snort iptables ips respon cepat terdeteksi serangan tanggap ratarata detik serangan terdeteksinya alert,0.0008727588960640076,0.9956359744938424,0.000872794756439366,0.0008728110274596985,0.0008728786773484549,0.0008727821488460103,KOMPUTASI,1
citra digital dimanfaatkan aspek kehidupanoleh membutuhkan tampilan citra merepresentasikan objek citra salah permasalahan pengambilan gambar citra kemampuan mengambil gambar luas gambar diambil kali menyebabkan gambar objeknya terpisahpisah mengatasi permasalahan proses penggabungan citra penelitian metode watershed metode ditentukan titik korespondensi masingmasing citra kandidat daerah hasil korespondensi disegmen menggunkan metode watershed hasil segmentasinya mencari region cut acuan penggabungan citra proses penggabungan citra dsebut mosaic panoramik hasil penelitian citra panorama ideal dperoleh citra masukan kesamaan obyek titik korespondensi dipilih obyek citra masukan kunci citra panorama mosaikpanoramik metode watershed,0.49145062653032384,0.001168336821000236,0.0011684809985161198,0.00116831677504354,0.5038758424246443,0.0011683964504719238,RPL,1
beasiswa pemberian bantuan keuangan perorangan bertujuan keberlangsungan pendidikan ditempuh program beasiswa diadakan meringankan beban mahasiswa menempuh studi kuliah biaya fakultas teknik universitas trunojoyo memiliki program beasiswa berhak menerima beasiswa bantuan belajar mahasiswa bbm beasiwa peningkatan prestasi akademik ppa jenis beasiswa memiliki kriteria faktor bobot berbeda seleksi beasiswa mengalami kesulitan banyaknya pemohon banyaknya kriteria manual mengakibatkan efektifnya keputusan membantu menetapkan layak menerima beasiswa dibutuhkan sistem pendukung keputusan metode penelitian analytic network process anp technique order preference by similarity to ideal solution topsis penelitian diangkat menganalisa validitas alternatif terbaik penerima beasiswa berdasarkan kriteriakriteria ditentukan metode anp dicari solusi pengurutan metode topsis berdasarkan hasil uji coba sistem perbedaan selisih hasil rekomendasi sistem data aktual pemenang beasiswa ppa jurusan informatika selisih hasil rekomendasi sistem data aktual pemenang beasiswa bbm jurusan informatika kunci anp topsis mcdm pengambilan keputusan multi kriteria seleksi beasiswa,0.0007268119945184138,0.0007267922959158775,0.9963659083588808,0.0007267882780805364,0.0007268737386727519,0.0007268253339316521,RPL,0
spare part salah pengoperasian mesin sepeda motor peningkatan penjualan spare part terduga proses tuneup menyebabkan kesulitan pelayanan terbaik konsumen penurunan penjualan spare part menyebabkan penumpukan spare part gudang sistem peramalan meramalkan penjualan spare part periode sistem peramalan metode jaringan syaraf tiruan algoritma propagasi momentum meramalkan penjualan spare part data tersimpan dihitung epoh learning rate berbeda hasil uji coba system disimpulkan data data training learning rate epoh menghasilkan tingkat kesalahan,0.0014371222249117527,0.325453725850881,0.0014370769041675768,0.001436947811543774,0.0014370191081060555,0.6687981081003899,KOMPUTASI,1
abstrak penjiplakan muncul berkembang bidang pendidikan karya tulis isinya menjiplak karya tulis orang mengatasi salah satunya solusinya aplikasi mengelompokan dokumen mendeteksi penjiplakan dokumen tugas aplikasi mendeteksi penjiplakan dokumen membandingkan dokumen pendeteksian penjiplakan dokumen algoritma winnowing algoritma winnowing berfungsi proses dokumen fingerprint merubah teks sekumpulan nilai nilai hash nilai hash mendeteksi tingkat kesamaan dokumen pengelompokan dokumen algoritma fuzzy kmeans hasil uji coba aplikasi diambil kesimpulan nilai ngram basis window hasil prosentase kemiripan dokumen menghasilkan nilai ngram basis window prosentase kemiripan dokumen menghasilkan prosentase perhitungan nilai fmeasure dipengaruhi keakuratan data diproses kunci deteksi penjiplakan cluster fmeasure,0.0010573999298564283,0.6971238967504269,0.001057359594836155,0.0010571988842080114,0.001057308206986286,0.2986468366336863,KOMPUTASI,1
sumber daya manusia mutlak dibutuhkan kemajuan perusahaan menjadikan perusahaan perusahaan maju kalah bersaing perusahaan dibuatlah sistem pendukung keputusan spk pemilihan karyawan berprestasi mencari karyawan berprestasi sistem pendukung keputusan spk fahp electre ii metode fahp metode obyektif proses penilaian berdasarkan hirarki kriteria digabungkan konsep fuzzy sesuai kriteria penilaian kinerja karyawan perusahaan bobot proses metode electre ii karyawan berprestasi menjaga penilaian berpihak salah karyawan bebas intervensi karyawan perusahaan independen profesional penilaian karyawan hasil penilaian angkaangka departemen sdm penjumlahan nilai komulatif kriteria karyawan terbaik prioritas kriteria metode fahp electreii hasil keluaran mendekati keakuratan hasil diperoleh areal manager banding hitung manual perusahaan memperhatikan bobot kepentingan,0.0009844184068983459,0.0009843398543889974,0.8012036539000845,0.0009844255586112791,0.19485877392701303,0.0009843883530038563,RPL,0
