Dokumen,Topik 1,Topik 2,Topik 3,Topik 4,Topik 5,Topik 6,Label,Cluster
memasuki ssb sekolah sepak bola pemain posisi pemain professional pemain kadang berubah posisi semestinya pelatih menentukan posisi pemain permainan data pemain tugas terkadang pelatih kesulitan keputusan menilai pemain obyektif proses pegambilan keputusan mengandalkan insting pelatih kehadiran teknologi sistem pendukung keputusan menentukan posisi pemain sepakbola pelatih membantu mencapai hasil maksimal pertandingan teknologi penulis tawarkan membangun sistem pendukung keputusan pemilihan posisi pemain terbaik berasal data pemain metode saw simple additive weighting fuzzy saw simple additive weighting metode penjumlahan terbobot konsep dasar metode saw simple additive weighting mencari penjumlahan terbobot rating kinerja alternatif kriteria fuzzy madm mencari alternatif alternatif kriteria,0.0011038961049226709,0.001103926021452587,0.0011039714109100358,0.0011038632968962947,0.9944803904330394,0.0011039527327790092,KOMPUTASI,2
sekolah sepak bola ssb menawarkan pelatihan pemain muda berlatih sepakbola metode latihan konvensional optimalnya pembinaan salah muncul pemilihan posisi pemain sesuai bakat pemain posisi pemain kondisi fisik kemampuan mengisi posisi contohnya pemain penyerang sayap semestinya memiliki kecepatan stamina pemain posisi pemain kemampuan pemain cenderung memaksakan posisi bermainnya kemampuannya berdasarkan permasalahan diatas sistem pendukung keputusan penentuan posisi pemain sepakbola berdasarkan hasil latihan pemain sistem kemampuan dasar pemain kemampuan dasar diproses metode smart profile matching hasil terkait posisi terbaik pemain sisten memiliki akurasi kesamaan mencapai pilihan pemain sistem diharapkan memudahkan pemain muda menentukan posisi terbaiknya mengoptimalkan kemampuannya,0.9944802937798921,0.001103949716716886,0.0011039076262977297,0.0011038126714503298,0.0011039642680188623,0.0011040719376239324,RPL,1
fashion kebutuhan pokok orang berkembangnya fashion dipengaruhi banyaknya inovasiinovasi toko menjual pakaian menarik minat pelanggan salah satunya fasilitas kamar ganti pelanggan pelanggan mencoba pakaian dibelinya permasalahan dikeluhkan pelanggan antrian kamar ganti keterbatasan membautuhkan pelanggan mencoba baju model baju menentukan ukuran baju pas permasalahan munculah teknologi kamar ganti virtual dikembangkan perusahaan fashion penelitian membahas salah metode mengimplementasikan teknologi kamar ganti virtual hardware kinect teknologi augmented reality pemanfaatan fitur kinect data skeleton user lebar badan pelanggan penentuan ukuran pakaian metode penelitian menghitung lebar badan pelanggan euclidean distance hasil eksperimen tehadap pengguna menunjukan tingkat akurasi sistem mencapai rekomendasi ukuran pakaian sesuai ukuran pelanggan,0.6222075113095064,0.001358806404964796,0.0013589076089847605,0.0013587970362269146,0.0013588382624176029,0.37235713937789966,RPL,1
sepak bola salah popular penonton partisipasi olahraga dunia angka adamenunjukkan popularitas sepak bola dibatasi geografi usia budaya jenis kelamin olahraga sepak bola pemain kiper dikategorikan salah posisi bek gelandang penyerang kombinasi gaya permainan berbeda pemain lapangan formasi formasi membutuhkan pemain sesuai skema permainan pelatih memiliki wewenang tertinggi menentukan pemain formasi tim kesalahan menentukan pemain berakibat fatal tim memenuhi ekspektasi tim penentuan pemain dipilih pelatih sesuai standar pelatih skill kemampuan pemain mempermudah menentukan pemain dibutuhkan sistem merekemondasikan pemain menyeleksi memilih pemain terbaik nilainilai pemain pemain terpilih dibentuk gaya skema permainan metode fuzzy tsukamoto membantu menghasilkan starting line up sepak bola sesuai harapan hasil perhitungan metode fuzzy tsukamoto nilai pemain pelatih menentukan pemain layak starting line up hasil penilaian metode fuzzy tsukamoto menghasilkan akurasi dimana nilai perbandingan rekomendasi hasil sistem rekomendasi line up pelatih pertandingan,0.001182139710043766,0.001182064395668271,0.9940892871016647,0.0011821433546382871,0.00118219564197492,0.0011821697960100557,RPL,0
proses pembelajaran kimia siswa sman pamekasan dikelas pembelajaran interaksi guru siswa didalam pendidikan membutuhkan sistem pembelajaran efektif efisien memudahkan guru siswa model permasalahan proses pembuatan media model sistem media pembelajaran tahapantahapan dasar media pembelajaran sederhana mudah dipelajari memecahkan dialami siswa aktivitas belajar tahap design pembelajaran diimplementasikan standarisasi pembelajaran jarak learning technology system architecture ltsa ltsa tujuan memudahkan komunikasi kolaborasi sistem aplikasi pembelajaran kimia berbasis learning technology system architecture guru proses belajar mengajar jarak guru materi atupun mudah siswa online hasil pengujian aplikasi kusioner didapatkan hasil nilai ratarata pernyataan diklasifikasi berdasarkan verifikasi user ratarata berdasarkan verifikasi guru hasil ratarata nilai siswa kelas x didapatkan ratarata kelas xi didapatkan ratarata ratarata nilai ratarata hasil kuisioner disimpulkan aplikasi bermanfaat siswa guru sman pamekasan kabupaten pamekasan proses pembelajaran kimia materi ikatan kimia,0.001377559230198335,0.001377567777502337,0.0013776325380484278,0.0013776057779135607,0.993112003658482,0.001377631017855422,KOMPUTASI,2
alcoholism kondisi dimana orang mengkonsumsi kecanduan minuman keras alkohol salah alcoholic pecandu alkohol merekam aktifitas otak menempelkan elektroda logam media konduktif kulit kepala electroencephalography eeg penelitian sinyal eeg diklasifikasikan kategori pecandu alkohol normal penelitian diawali preprocessing independent component analysis ica dimana proses preprocessing sinyal sinyal eeg dibersihkan noise sinyal bersih noise ektraksi fitur discrete wavelet transform dwt didapatkan fitur sinyal eeg proses seleksi fitur genetic algortihm ga mencari fitur fitur terbaik sinyal eeg fitur fitur terbaik didapatkan barulah proses klasifikasi jaringan saraf tiruan counterpropagation network cpn penelitian menghasilkan akurasi tertinggi scenario metode counterpropagation network cpn cocok proses klasifikasi sinyal eeg,0.0010573401122774008,0.0010572336434881953,0.0762003377855545,0.0010572182790496239,0.15772757704608986,0.7629002931335404,RPL,1
proses pemeringkatan kinerja koperasi manual memiliki kelemahan objektivitas dasar penilaian terjaga proses pemeringkatan kinerja koperasi butuh keberadaan sistem pemeringkatan kinerja koperasi menerapkan teknologi informasi dibutuhkan salah pendekatan diterapkan peraturan menteri koperasi usaha menengah republik indonesia nomor permkukmiv pedoman pemeringkatan koperasi mudah praktis menilai koperasi mengikuti kegiatan pemeringkatan kinerja koperasi peraturan menteri koperasi usaha menengah republik indonesia nomor permkukmiv cocok diterapkan proses pemeringkatan kinerja koperasi penerapan sistem informasi diharapkan proses pemeringkatan kinerja koperasi ujicoba koperasi kesimpulan sistem informasi proses pemeringkatan kinerja koperasi berdasarkan peraturan menteri koperasi usaha menengah republik indonesia nomor permkukmiv framework mvc tercapai kunci peraturan menteri koperasi usaha menengah republik indonesia nomor permkukmiv pemeringkatan kinerja koperasi manual,0.8451942717521868,0.0013056824901525037,0.0013057916468366454,0.14958266800038902,0.0013058446615309143,0.001305741448904175,RPL,1
,0.0009209646764741632,0.0009208613076788358,0.5696841296887425,0.0009209840054520867,0.4266320654718532,0.0009209948497993884,RPL,0
sertifikasi guru salah program kerja kementerian pendidikan kebudayaan kemdikbud republik indonesia bertujuan sertifikat pendidik guru dianggap layak program dilaksanakan wilayah indonesia salah satunya lingkungan dinas pendidikan kabupaten sumenep peserta sertifikasi guru melengkapi persyaratan diverifikasi proses verifikasi membutuhkan sumber daya menekan kebutuhan sumber daya dibutuhkan sistem terkomputerisasi membantu terkait menentukan peserta sertifikasi guru lingkungan dinas pendidikan kabupaten sumenep tersedia sistem kemdikbud menentukan peserta sertifikasi guru diakses online kekurangannya memecahkan peneliti merancang spk sistem pendukung keputusan diintegerasikan metode fahp fuzzy analytical hierarchy process berdasarkan hasil penelitian penerapan spk diintergerasikan metode fahp membantu terkait menentukan peserta sertifikasi guru penerapan metode fahp hasil dibuktikan hasil uji akurasi mencapai persen periode periode penentuan peserta sertifikasi guru,0.0015018208434127614,0.0015015937142909411,0.0015017891857340613,0.0015017151247108146,0.07340302577013462,0.9205900553617169,RPL,1
perusahaan kegiatan produksi berkumpulnya faktor produksi perusahaan terkecuali perusahaan skala menengah menbutuhkan sistem mengintegrasikan jalanya usaha cepat mudah jalankan proses tranksaksi pencatatan informasi stok barang manual menghambat pelanggan menunggu me ngakibatkan minat pelanggan membeli produk berkurang berdasarkan permasalahan diatas sistem informasi peneranan customer relationship management crm usaha menengah ukm sistem berbasis web framework codeigniter berdasarkan uji coba sistem kuisioner didapatkan hasil tingkat akurasi petugas gudang kasir s iste m memudahkan proses transaksi pencatatan informasi ba rang tersedia didalam gudang,0.33557194658240735,0.0013405821276638156,0.6590650979440461,0.001340746787745811,0.0013408591528225808,0.0013407674053146253,RPL,0
game pembelajaran metamorfosis metamorph salah game edukasi biologi game membantu pemain belajar proses metamorfosis game metamorph menyerupai game penjumlahan kotak kemunculannya diatur acak game metamorph fitur pembeda pembelajaran metamorfosis android media game game bermain game penelitian game metamorph dibangun framework cocosdx bahasa pemrograman c media implementasi dipilih smartphone berbasis android penelitian hasil implementasi framework cocosdx cocosdx framework engine memiliki class pengambilan keputusan nilai kotak posisinya diatur class random disediakan cocosdx framework runut menentukan nilai posisi kotak penelitian diperoleh kesimpulan cocosdx framework mesin pembangun game metamorph game berjalan lancar tampilan proporsional uji coba device,0.0013588180608948318,0.0013587925028449878,0.0013589142742470165,0.15876782712001308,0.8357966148816757,0.0013590331603242536,RPL,2
utama dimiliki investor fluktuasi harga saham dinamis berubah perubahan investor kebingungan memilih saham dibeli saham dijual sektor telekomunikasi salah satunya persaingannya xl axiata indosat telkomsel smartfren prediksi harga saham metode neural network algoritma backpropagation momentum data harga saham ditentukan berdasarkan runtunan time series algoritma jaringanjaringan dilatih data harga saham situasi membantu investor pengambilan keputusan periode berikutnyaberdasarkan hasil peramalan harga saham backpropagation momentum autokorelasi arima menghasilkan nilai ratarata akurasi mse terkecil mape selisih error dihasilkan jaringan autokorelasi akurat dibandingkan peramalan autokorelasi mape dihasilkan kunci jaringan syaraf tiruan backpropagation arima momentum prediksi harga saham,0.0013589089459274787,0.001358831907663333,0.0013589807212408009,0.11442112558506533,0.8801432623173898,0.0013588905227133066,RPL,2
,0.0009942229703067836,0.0009942680090155116,0.5831413857954293,0.0009942367996910464,0.16886381649810273,0.2450120699274546,KOMPUTASI,0
citra salah sumber informasi cepat dipahami mata menyebabkan citra bertambah memenuhi kebutuhan informasi sistem temu citra teknik dikembangkan mempermudah pencarian citra sistem temu citra sistem pencarian citra berdasarkan fitur utama citra fitur utama warna tekstur bentuk informasi citra sistem temu citra menerima input citra mengembalikan citra relevan citra input diekstraksi fiturnya metode sesuai fitur ekstraksi fitur proses pengukuran jarak kemiripan penelitian input citra warna rgb citra inputan dikonversi citra hsv tahap kuantisasi warna citra hsv tahap pengukuran jarak kemiripan citra query terkuantisasi citra database euclidean distance pengujian sistem skenario penentuan data training data query penelitian tingkat akurasi sistem dihitung recall precision skenario tingkat akurasi tertinggi didapatkan skenario ii recall precision,0.0009653935781140312,0.0009654407355248719,0.04835750156280287,0.03626497715222835,0.8955524059559201,0.017894281015409734,KOMPUTASI,2
kecanggihan teknologi berkembang memanfaatkannya struktur kehidupan salah satunya pendidikan studi dimana pelaksanaan ujian konvensional dianggap efektif efisien membutuhkan biaya membutuhkan pelaksanaannya rentan kecurangan siswa perbaikan mengubah sistem ujian berbasis komputer pelaksanaan ujian memperhatikan tindak kecurangan siswa mencontek kerja bertukar ujian efektif permasalahan sistem ujian menghasilkan lulusan bermutu mengandalkan kejujuran salah ditempuh mengubah system ujian mengacak soalsoal ujian metodemetode pengacakan tersedia linear congruent method lcm mengacak ujian masingmasing peserta muncul masingmasing peserta membutuhkan system paket system penerapan lcm metode pengacakan ujian online mengurangi kecurangan siswa efektif siswa ujian online kunci metode lcm linear congruent method pengacakan,0.0007014609755103443,0.19881376517923116,0.0007013887280209265,0.0007013676949556441,0.7983806972627545,0.0007013201595273853,KOMPUTASI,2
pt fastrata buana pamekasan sales langsung berhubungan pelanggan pt fastra buana memiliki permasalahan keberadaan sales jam lapangan transaksi barang toko pelanggan kecurangan monitoring aktivitas sales data transaksi tulis hilang permasalahan diatas anternatif pemecahan aplikasi implementasi location based service monitoring aktivitas sales teknologi global positioning system layanan informasi diakses mobile device network memanfaatkan lokasi mobile device penelitian disimpulkan mengurangi tingkat kecurangan sales letak posisi sales meningkatkan kinerja mengurangi kehilangan data hasil uji coba mekanisme pengujian location based service device kali pengujiaan teknologi location based service cocok monitoring sales data terkirim realtime,0.0008027315832461323,0.0008028078063064335,0.0008026795197684817,0.0008027102988850852,0.9959864121324676,0.0008026586593262788,KOMPUTASI,2
epilepsi penyakit kelainan saraf otak menyerang manusia tanda tanda serangan epilepsi penderita epilepsi penyakit diturunkan gen factor pembawa epilepsi berasal orangtua penyebab epilepsi epilepsi dicegah semenjak perawatan mahal murah bidang medis epilepsi ditangani pengobatan medis operasi neurostimulation solusi penelitian bertujuan mengidentifikasi teridentifikasi penderita electroencephalogrameeg metode merekam informasi aktifitas otak manusia sampel ekstraksi fitur haar wavelet proses menguraikan sinyal kedalam level decompose level proses klasifikasi metode euclidean distance klasifikasi data proses dicari nilai akurasi penelitian haar wavelet decompose level confusion matrix penelitian menghasilkan jangkauan nilai akurasi menyimpulkan pengaruh decompose level komputasi,0.000765789290765355,0.0007657859838848416,0.0007657795498988487,0.0007657957753907663,0.9961710735215884,0.0007657758784719687,RPL,2
electroencephalogram eeg teknik perekaman gelombang otak manusia elektroda dipasang kulit kepala manusia hasil data sinyal identifikasi penderita epilepsi data penelitian data the bernbarcelona eeg database jenis data subjek data focal subjek data nonfocal subjek direkam channel penangkap sinyal direkam sampel hz penelitian tahap tahap ekstrasi fitur time and frequency distribution tahap seleksi fitur genetic algorithm tahap ketiga klasifikasi nave bayes hasil percobaan seleksi fitur memiliki pengaruh sistem menambah tingkat akurasi akurasi tertinggi mencapai,0.26704935176413125,0.19038268389572377,0.0008434312777187011,0.0008433645968098644,0.5400378854346252,0.0008432830309911922,RPL,2
,0.000682243884414456,0.17768442772486837,0.0006822027355769043,0.0006821832678899296,0.8195867434413333,0.0006821989459171404,KOMPUTASI,2
peningkatan pembinaan pemain bola voli ditingkat daerah menghasilkan pemain bola voli berkualitas penyeleksian pemain subjektifitas menghambat regenerasi pemain bola tim bola voli pelatih memilih pemain bola voli masuk tim dibentuknya tugas pelatih bola voli pbvsi kabupaten sumenep kesulitan memilih pemain berkualitas berdasarkan permasalahan tes sistem pendukung keputusan pelatih mudah memilih pemain sistem pendukung keputusan metode smart diharapkan pelatih pbvsi kabupaten sumenep mudah pemain berkualitas hasil penilaian seleksi metode smart menghasilkan nilai akurasi nilai akurasi dapatkan hasil perbandingan data hasil perhitungan sistem data rekomendasi pelatih,0.3840538788275244,0.0010462168881732905,0.23960557071261795,0.0010461447317840356,0.11053716458372646,0.2637110242561738,RPL,1
,0.000777664388267669,0.0007776436563841297,0.9961116539359572,0.000777639770620035,0.0007777018448697152,0.0007776964039012625,RPL,0
kabupaten bangkalan salah kabupaten potensi usaha mikro menengah umkm tercatat umkm rekapitulasi data umkm kabupaten bangkalan dinas koperasi umkm bangkalan sekian banyaknya umkm hadapi kurangnya media informasi detail terkait letak lokasi jenisjenis produk umkm dihasilkan wilayah masyarakat bangkalan masyarakat asing bangkalan dibuatlah aplikasi web berbasis sistem informasi geografis pemetaan usaha mikro menengah umkm bangkalan data evaluator hasil nilai ratarata berdasarkan nilai penggunaan sistem berdasarkan nilai desain tampilan sistem aplikasi mencapai tujuan diharapkan,0.6067920099432977,0.000737530710016046,0.0007376024276548611,0.0007375608376473781,0.0007375778834371457,0.3902577181979468,RPL,1
kesehatan gigi mulut orang terkadang orang memikirkan kesehatan giginya langsung mengalami sakit gigi terkena penyakit gigi mulut penanganan perawatan membantu penyembuhan penyakit gigi cepat penanganannya menambah permasalahan kesehatan giginya kemampuan analisa akurat diagnosa penyakit mengatasi permasalahan salah solusinya sistem pakar mendiagnosa penyakit gigi mulut pencegahan sistem pakar mengadopsi pengetahuan ahli dibidangnya sistem pakar dibangun metode naive bayes metode cocok pengambilan keputusan mendiagnosa penyakit gigi mulut konsep sederhana mudah dipahami sistem dibangun berbasis web memudahkan penggunaanya masyarakat luas pengujian sistem data uji coba skenario hasil uji konsultasi sistem sistem menentukan penyakit presentase tingkat akurasi keberhasil,0.0008882070021090988,0.000888180052085974,0.0008882078409347687,0.0008884494256734856,0.9955587232150963,0.000888232464100425,RPL,2
manusia pengenalan obyek citra mudah pengenalan obyek citra mesin mudah mesin membaca nilai pixel citra masukan menghasilkan nilai menentukan kelas citra penelitian metode convolutional neural network cnn pengenalan obyek citra metode feature engineering cnn layer convolution layer pooling layer fully connected dataset pelatihan dataset citra cifar dataset cifar memiliki citra kelas mempermudah pembuatan aplikasi framework deep learning theano penelitian bertujuan dampak ukuran filter kedalaman layer cnn hasil penelitian ukuran filter menambah tingkat akurasi akurasi tertinggi penelitian,0.38590620630836375,0.001116392369547687,0.6096285337076371,0.0011161682029209945,0.0011162929783183875,0.0011164064332121356,RPL,0
banyaknya ikm industri menengah masuk kedalam data calon penerima bantuan restrukturisasi mesin disperindag bangkalan menyebabkan kesulitan menentukan ikm penerimaan bantuan dimana proses penyaluran manualpun dirasa efektif diterapkan metode dirancang kedalam sistem pendukung keputusan mencakup kriteriakriteria penilaian menyimpan datadata berkaitan pemilihan industri menengah ikm bangkalan sekian metode dilandaskan sistem pendukung keputusan metode dianggap metode topsis technique for order reference by similarity to ideal solution topsis memiliki konsep dimana alternatif kandidat terpilih alternatif terbaik memiliki jarak terpendek solusi ideal positif jarak terjauh solusi ideal negatif hasil penentuan kriteria pemilihan didapatkan tujuh kriteria investasi tenaga kerja legalitas usaha izin industri sertifikat sni partisipasi mesinpenerapan aplikasi diharapkan kontribusi desperindag sisi eferktifitas efisiensi,0.0010143954342202222,0.0010142561287099121,0.994928378156818,0.0010142916769173293,0.0010143579349597576,0.0010143206683748112,RPL,0
penyakit stroke penyakit mematikan indonesia menempati urutan nomer jantung kanker sesuai pengamatan peninjauan yayasan stroke indonesia yastroki rumah sakit masyarakat kecenderungan meningkatnya penyandang stroke indonesia mendukung pakar mendiagnosa penyakit stroke dibangunlah sistem pakar sistem dibangun metode certainty factor metode membuktikan fakta berbentuk matrik sistem pakar hasil penelitian diharapkan mendukung pakar mendiagnosa penyakit stroke penelitian dihasilkan sistem pakar mendiagnosa penyakit stroke pengujian data pasien diperoleh nilai akurasi,0.0009563203644473373,0.0009561200595317934,0.0009563581777318591,0.0009561586743091136,0.9952189146739996,0.0009561280499803662,RPL,2
mengatasi permasalahan kemiskinan kabupaten sampang melaksanakan program gerakan sampang harmonis bermartabat program komitmen bupati sampang gubernur profinsi jawa timur amanatkan rencana pembangunan jangka menengah daerah kabupaten sampang mengentaskan kemiskinan sampang memiliki angka kamiskinan sejawa timur tingginya kemiskinan butukan sistem merangking keluarga miskin penelitian bangun sistem pendukung keputusan metode simple multiatribut ranting technique exploitng ranks metode metode multiple criteria decision making hasil peroleh sistem merangking keluarga miskin efisien cepat mudah kelayakannyadi ukur metode descriptive statistical,0.0009654075284864425,0.0009654618997604329,0.000965519144426047,0.0009653732831705702,0.9951728619728152,0.0009653761713412924,KOMPUTASI,2
sektor pertanian kabupaten sumenep memiliki beragam jenis tanaman unggul padi jagung kedelai kacang tanah ubi kayu jenis tanaman pembangunan pertanian mengalami hambatan kesuburan tanah rendah pembangunan pertanian tradisional memperhatikan aspek kesesuaian lahan tanaman analisa potensi lahan pertanian rekomendasi pemanfaatan lahan sesuai hasil panen maksimal mengatasi aplikasi pemetaan daerahdaerah pertanian kabupaten sumenep salah metode permasalahan gis geographical information system penerapan aplikasi diharapkan informasi pengguna daerahdaerah pertanian kabupaten sumenep pengguna menganalisis tanaman cocok masingmasing daerah,0.0008361959368306808,0.0008361820605915606,0.5503168441842679,0.0008362839625343479,0.4463383139150734,0.0008361799407022306,RPL,0
informasi terkait geografis dibutuhkan informasi jarak lokasi fasilitas dicari informasi sistem informasi geografis sig salah solusi informasi geografis daerah pariwisata kabupaten sumenep obyek dijadikan bahan penelitian skripsi kabupaten sumenep memiliki keanekaragaman tempattempat wisata wisatawan sistem inforamasi pariwisata kabupaten sumenep berbasis android mempermudah wisatawan mencari informasi wisata kabupaten sumenep data evaluator hasil nilai ratarata berdasarkan nilai penggunaan sistem berdasarkan nilai desain tampilan sistem aplikasi mencapai tujuan diharapkan kunci sistem informasi geografis mobile android pariwisata,0.0010572381483733382,0.0010572442879093415,0.0010574717577311323,0.0010571904838428848,0.9947132505349403,0.0010576047872029226,KOMPUTASI,2
aplikasi maze dipasaran kebanyakan game maze maze statis menyebabkan level memiliki tampilan solusi mengakibatkan player cepat selesai cepat bosan maze dinamis tampilan solusi maze ukuran dimensi berubah ubah permainan dijalankan level permainan memiliki tampilan maze menambah daya tarik permainan maze kesan player didalam maze teknologi augmented reality penelitian game maze ar dinamis generator maze metode hunt and kill metode memiliki keunggulan persentase dead ends longest path metode cocok diterapkan dikombinasikan teknologi augmented reality dimana player berjalan real dunia nyata menyelesaikan permainan hasil uji coba penelitian responden puas kinerja game maze penelitian berhasil bentuk maze dinamis berdasarkan metode hunt and kill,0.000965427416115206,0.0009653999871117838,0.0009655820607413073,0.000965341736943613,0.9951728189953443,0.0009654298037437144,RPL,2
smart city marak diperbincangkan solusi memecahkan permasalahan timbul akibat dinamika kota maju modern tujuan penerapan konsep smart city meningkatkan aman nyaman warganya kota efektif efisien meningkatkan daya saing pertumbuhan ekonomi pemerataan penghasilan madura pulau terletak disebelah utara pulau jawa pulau dijuluki tanah garam dikenal bidang kesenian kerapan sapi kerajinan batik kabupaten bangkalan kabupaten bangkalan kota berkembang penerapan konsep smart city salah memanfaatkan peluang kebutuhan pasar pecinta batik kemudahan akses lokasi memanfaatkan teknologi pencarian lokasi google maps metode kartesius perangkat elektronik smartphone konsumen dipermudah pencarian informasi lokasi pengrajin batik tersebar diseluruh wilayah kabupaten bangkalan kunci smart city batik google maps metode kartesius smartphone android,0.0011161743679579319,0.0011162065865236012,0.5064309946583094,0.0011161702589063828,0.0011163022895015486,0.4891041518388011,KOMPUTASI,0
