Dokumen,Topik 1,Topik 2,Topik 3,Topik 4,Topik 5,Topik 6,Label,Cluster
peringkasan teks otomatis salah bidang information retrieval ir menawarkan solusi mencari informasi dokumen peringkasan teks dokumen tersimpan didalam database overload retrieval cepat implementasi peringkasan teks otomatis hasil nilai akurasinya rendah penelitian dikembangkan aplikasi peringkasan teks otomatis berbahasa indonesia berbasis natural language processing jaringan syaraf tiruan metode single layer perceptron slp metode pembelajaran terbimbing jst slp dipilih salah bentuk jst sederhana nilai threshold slp dilatih sistem otomatis menentukan kalimat dijadikan ringkasan perhitungan bobot term berdasar prinsip tfidf klasifikasi nlp bias nominal verbal adjectiv adverb numerik hasilnya diklasifikasikan kalimat proses evaluasi dihitung berdasarkan teks diringkas ahli tata bahasa indonesia majority opinion hasil penelitian nilai ratarata precision nilai ratarata recall nilai ratarata fmeasures nilai accuracy,0.000920954040460271,0.000920962509459641,0.730635998222705,0.0009209914224340651,0.2656801539315124,0.0009209398734287079,KOMPUTASI,0
sistem informasi akademik sekolah sistem dirancang kebutuhan pengelolaan data akademik penerapan teknologi komputer bertujuan informasi berkaitan akademik sekolah smp pawiyatan salah sekolah swasta surabaya memiliki aplikasi terkomputerisasi terancang pengelolaan data akademik pengelolaan data akademik smp pawiyatan excel data akademik dicatat pengelolaan sistem manual smp pawiyatan surabaya mengalami pengerjaan efektif efisien pencarian data guru siswa nilai akademik siswa sekolah mencari persatu arsip tersimpan penelitian peneliti merancang sistem informasi akademik sekolah berbasis web studi sistem dilaksanakan smp pawiyatan surabaya permasalahan metode penelitian mebuat perancangan sistem informasi akademik berbasis web metode waterfall meliputi analysis design coding testing penelitian diharapkan membantu sekolah pengelolaan datadata akademik efektif efisien informasi siswa guru wali kelas berkaitan informasi akademik langsung bersangkutan,0.0008727777020513275,0.23313306847655108,0.0008727896817500726,0.24848034613824396,0.000872838169255529,0.5157681798321481,KOMPUTASI,1
posyandu kelurahan kebalandono salah bentuk kesehatan berbasis masyarakat kesehatan anak kegiatan kader posyandu pengolahan data posyandu bersifat manual pencatatan pelaporan pelayanan sistem informasi posyandu bersifat manual dikembangkan sistem terkomputerisasi pembuatan sistem diharapkan membantu kinerja petugas posyandu administrasi pelaporan posyandu informasi dihasilkan sistem informasi posyandu laporan pelayanan posyandu meliputi laporan balita laporan laporan imunisasi laporan vitamin a laporan status gizi pembuatan sistem informasi framework langkah kerja penelitian framework fea panduan perencanaan pembuatan sistem informasi fea framework framework menganalisa desain target desain dicapai penelitian dihasilkan sistem informasi posyandu kelurahan kebalandono kepuasaan user mencapai,0.0012108077612080729,0.0012107754245869065,0.8332152752091686,0.001210722670812607,0.16194167250368632,0.001210746430537245,RPL,0
puskesmas teja inti pelayanan kesehatan kabupaten pamekasan pengolahan data puskesmas bersifat manual banyaknya pasien berkunjung puskesmas membutuhkan pencarian data pasien puskesmas membutuhkan sistem informasi pemrosesan data data registrasi pasien data pasien poli gigi data pasien poli data poli kia data pasien lab data obat penelitian dibahas sistem informasi puskesmas puskesmas teja membangun sistem informasi framework langkah kerja framework kumpulan script membantu programmer menangani masalahmasalah pemograman penelitian framework fea dimana framework menganalisa desain target desain dicapai feaf memiliki komponen utama arsitektur bisnis arsitektur data arsitektur aplikasi arsitektur teknologi penelitian dihasilkan sistem informasi membantu puskesmas pengolahan data pasien berdasarkan hasil uji coba sistem petugas puskesmas diperoleh persentase setuju setuju setuju segi interaksi pengguna sistem kecepatan kemudahan akses informasi kepuasan user sistem informasi,0.0008882475374882853,0.0008881625509724237,0.0008881972775672518,0.0008882408592990044,0.9955589239090027,0.0008882278656704961,RPL,2
lembaga sekolah perekapan administrasi keuangan konvensional halnya lembaga pendidikan islam al haromain excel proses administasi keuangan kegiatan proses administrasi efektif efisien sistem informasi keuangan sekolah solusi permasalahan sistem informasi keuangan sekolah menangani prosesproses pengolahan keuangan sekolah meliputi transaksi penerimaan pengeluaran sedangakan membantu kebijakan keuangan sistem informasi keuangan sekolah dilengkapi fitur forecasting memprediksi penerimaan pengeluaran saldo lembaga metode proses forecasting metode exponential smoothing metode memiliki kemampuan proses prediksi metode memiliki nilai parameter pengaruh hasil prediksi kunci forecasting exponential smoothing keuangan sekolah sistem informasi keuangan sekolah,0.0007542536744923482,0.0007542269991803245,0.0007542729954241767,0.0007542945986749577,0.9962287305507004,0.0007542211815278511,RPL,2
sistem informasi pembayaran spp sekolah sistem dirancang kebutuhan pengelolaan data pembayaran spp penerapan teknologi komputer bertujuan mempermudah pekerjaan petugas bank mini smkn sampang salah sekolah negeri sampang memiliki sistem terancang pengelolaan data pembayaran spp pengelolaan data pembeyaran spp smkn sampang menggunkan buku pencatatan pengelolaan sistem manual smkn sampang mengalami pengerjaan efektif efisien sekolah mencari persatu arsip tersimpan pengawasan pembayaran spp sekolah maksimal sekolah terkadang telat siswasiswi pembayaran spp penelitian peneliti merancang sistem informasi pembayaran spp sekolah berbasis web studi sistem dilaksanakan smkn sampang permasalahan penelitian diharapkan membantu sekolah pengelolaan datadata akademik efektif efisien,0.001524812007697002,0.9923762485759777,0.0015248280147698772,0.0015245761049991191,0.0015248183014667947,0.0015247169950894262,KOMPUTASI,1
penjaminan mutu perguruan proses perencanaan pemenuhan pengendalian pengembangan standar pendidikan konsisten berkelanjutan pemangku kepentingan internal eksternal perguruan mahasiswa dosen karyawan masyarakat dunia usaha asosiasi profesi pemerintah memperoleh kepuasan kinerja keluaran perguruan tugas bertujuan tingkat kepuasan mahasiswa berdasarkan kuesioner ditentukan tim penjaminan mutu fakultas teknik universitas trunojoyo tingkat kepuasan mahasiswa skala deskriptif skala likert sistem memiliki kemampuan mengambil data input kuesioner pegajaran dosen praktikum administratiffasilitas kuliah tamu workshop pengguna sistem mahasiswa dosen dimana mahasiswa mengisi kuesioner dosen nilai dhasilkan kuesioner diisi mahasiswa penelitian objek penelitian fakultas teknik universitas trunojoyo madura hasil uji fungsionalitas didapatkan hasil penilaian pengujian masuk kriteria pengujian kuesioner sampel responeden jurusan fakultas teknik memiliki nilai diatas,0.9942914688644952,0.001141632448115329,0.0011416522981070108,0.0011416861807706223,0.0011417122566665975,0.0011418479518451568,RPL,1
abstrak pembuatan game save the madura island bertujuan melestarikan budaya lokal khusunya budaya madura orang tinggalkan perkembangan teknologi pesat pengenalan budaya berbasis game diharapkan menarik minat masyarakat mengenal budayabudaya lokal ciri khas bangsa game save the madura island game strategi mengangkat tema budaya madura user mempelajari budaya madura senang memainkan game game save the madura island algoritma greedy kecerdasan buatan terletak karakter defense berfungsi membantu karakter defense menentukan enemy efektif diserang game save the madura island dijalankan diberbagai device android jenis os berbedabeda penggunaan algoritma greedy game save the madura island membantu mengurangi enemy lolos penggunaan algoritma greedy game save the madura island membantu user mempertahankan life kunci game madura tower defense algoritma greedy,0.0008505172725519195,0.0008506301127197103,0.29546472236587007,0.0008506064646697893,0.7011329915321871,0.0008505322520011989,KOMPUTASI,2
elearning diterapkan sma negeri pamekasan elearning mata pelajaran fisika kelas x sepuluh kelas x pembelajaran sistem pembelajaran media elektronik pelajaran fisika elearning fisika kelas x mengkombinasikan pertemuan tatap muka pembelajaran elektronik meningkatkan kontribusi interktif siswa sistem dirancang mencari nilai tertinggi siswa dibidang fisika nilai tertinggi siswa ditentukan nilai akademik siswa metode saw metode saw metode penjumlahan terbobot proses perengkingan sistem metode saw pembobotan hasil belajar siswa guru nilai akademik siswa dibidang fisika menentukan siswa terbaik bidang fisika kunci elearning fisika sma kelas x berbasis web saw,0.001046423813943526,0.34666154380912306,0.0010463274262201606,0.0010463867980803605,0.649153175656389,0.00104614249624383,KOMPUTASI,2
log web server menyimpan kegiatan pengunjung web site server interaksi pengunjung web meningkatkan ukuran rekaman data log tersimpan web server pembengkakan volume data dihindari sayangnya kebanyakan web administrator manfaat data log tersimpan menggali informasi bermanfaat pengembangan situs web data mining menambang data informasi diperoleh informasi dimasukkan difokuskan penemuan pola pengelompokkan pengunjung tersimpan web server log teknik kmeans clustering analisis web server log informasi pola kunjungan menemukan aturan clustering berguna peningkatan efektifitas web site uji coba aplikasi menghasilkan pola pengelompokkan berdasarkan ip lokal public ip lokal pola kunjungan dominasi ip puskom rektorat fakultas pertanian fisib ip publik pola kunjungan ratarata mengakses halaman utama web site beranda pola diperoleh ip lokal ditambah ip public,0.0008882078436515175,0.9955586402230888,0.0008883645237924975,0.000888208547278076,0.000888321186148267,0.0008882576760408577,KOMPUTASI,1
tanah lapisan permukaan bumi tumbuh tanaman salah faktor menunjang pertumbuhan perkembangan tanaman kelembaban tanah seiring berkembangnya ilmu pengetahuan teknologi penulis mencoba perancangan sistem mengontrol memantau tanaman kelembaban tanah indikator tanah berbasis jaringan sensor nirkabel arduino pengukuran kelembaban tanah tanaman memanfaatkan sensor kelembaban tanah bertipe yl sensor bertipe fc nilai terukur sensor diolah mikrokontroler arduino terhubung ethernet shield hasil pengukuran sensor dikirim jaringan internet langsung terhubung database server hasil pengukuran tampilkan web server aplikasi web informasi detail akurat perancangan pengimplementasian sistem monitoring tanaman berbasis jaringan sensor nirkabel pemantuan pengolahan tanaman otomatis terkontrol hasil pengujian pengujian ruang outdoor indoor berbeda nilai kelembaban tanah ruang indoor stabil dibuktikan menghitung simpangan baku tanaman ruang indoor outdoor perbedaan nilai simpangan baku tanaman i tanaman ii tanaman iii kunci jaringan sensor nirkabel web server arduino jaringan internet kelembaban tanah,0.0008157315653337291,0.000815754818307434,0.2357323765408533,0.0008158361714769462,0.31427850739799706,0.4475417935060315,KOMPUTASI,1
plagiasi penjiplakan pengambilan karangan pendapat orang menjadikannya karangan pendapat plagiasi utamanya karya ilmiah mendeteksi tingkat plagiasi karya dibutuhkan dibutuhkan sistem membantu mendeteksi plagiasi salah algoritma aplikasi pendeteksi plagiasi algortima rabinkarp algoritma fungsi hashing efektif pencarian multiple pattern penelitian merancang sistem mendeteksi tingkat plagiasi karya algortima rabinkarp sistem membantu mempercepat pengecekan tingkat plagiasi karya hasil penelitian treshold penggunaan preprocessing ratarata komputasi detik preprocessing ratarata komputasi detik,0.0012725072292449596,0.0012723635628567407,0.9936379784378377,0.0012723369238807221,0.001272449026645645,0.0012723648195341122,RPL,0
suara salah bentuk komunikasi informasi suara direpresentasikan bentuk gelombang longitudinal merambat zat cair padat gas derau noise sinyal gangguan berasal suara menyebabkan gangguan sinyal suara informasi mengganggu kenikmatan hiburan didengarkan pengurangan derau noise reduction gelombang suara pengurangan noise gelombang suara spectral subtraction method spectral subtraction method discrete fourier transform dft metode representasi sinyal frekuensi memperbaikinya windowingframing smoothing algorithm perbaikan data suara bernoise utdallas the university of texas at dallas pengurangan noise gelombang suara spectral subtraction berdasarkan hasil uji coba dft teknik smoothing algorithm meningkatkan kualitas snr db,0.0008961851170644565,0.12127129975008841,0.8751437433268633,0.0008962870287210502,0.0008963401585639434,0.0008961446186988919,KOMPUTASI,0
salah media pembelajaran menunjang belajar siswa memahami materimateri media digital interaktif belajar media unik menarik menarik siswa aktif berfikir kritis siswa mendalami materi pelajari game edukasi media menarik menyenangkan menunjang proses belajar mengajar penelitian game edukasi acak madura ajer ocak madura metode lcm linear congruent method pengacakan pembelajaran membahas gambar diartikan kedalam bahasa madura tingkatan bahasa engghibhunten tujuan perancangan permainan system belajar menarik anak belajar bahasa madura hasil uji coba game acak madura game edukasi pengujian responden orang berbahasa madura keseharian aktif responden berbahasa madura keseharian pasif hasil kategori game bola tangkap responden orang berbahasa madura keseharian aktif meningkatkan kemampuan kategori game tebak gambar responden berbahasa madura pasif nilai kemampuan game bola tangkap kategori game tebak gambar,0.0007718136679812343,0.0007716980691933315,0.2259493586035654,0.0007716707180246972,0.7709636512858521,0.0007718076553832796,RPL,2
seiring perkembangan teknologi pesat bidang multimedia manusia dituntut memiliki kemampuan bahasa bagus bahasa inggris memiliki peranan salah bahasa dipelajari teknologi maju bidang multimedia bahasa inggris bahasa mendasar berkomunikasi pembuatan game edukasi berkembang pesat ditengahtengah masyarakat anak bosan belajar bahasa inggris gemar bermain game perancangan game edukasi media pembelajaran interaktif menarik minat anakanak belajar game bahasa inggris pengguna belajar pengucapan pengenalan warna namanama pengguna menikmati permainan disediakan menebak gambar berdasarkan hasil uji coba pengguna game user friendly responden game menarik responden game sulit sisi materi responden membantu permainan sisanya terbantu kunci game bahasa inggris edukasi anak,0.0011416497257521706,0.0011415905532756322,0.9942915363375285,0.0011416570688470046,0.0011419015470864036,0.001141664767510154,RPL,0
perkembangan nya pemain mobile game bertambah rela membeli premium item game mainkan pemain mobile game indonesia kesulitan transaksi sistem inapp purchase game media pembayaran uang digital memiliki keterbatasan media pembayaran pemotongan pulsa dimiliki operator seluler media pembayaran ads disukai pengguna mobile game solusi permasalahan menggabungkan augmented reality sistem mcommerce acommerce menangani transaksi inapp purchase menarik pemain solusi pembayaran memakai kartu marker pembelian item game aplikasi acommerce kepuasan pengguna inovasi penjualan menarik performa kecepatan aplikasi nilai terkecil tingkat kepuasan pengguna aplikasi acommerce bergantung cahaya jarak mendeteksi marker marker vignette comic glow old poster nilai keberhasilan pendeteksian kondisi marker black white blur pixel old pastel prosentase keberhasilan berbeda kondisi marker terdeteksi berbeda marker asli,0.0009294999951697732,0.0009294253032314652,0.995352564640423,0.0009294370776389109,0.0009295044041873003,0.0009295685793495344,RPL,0
universitas trunojoyo madura salah kampus dipulau madura memiliki fakultas salah satunya fakultas teknik fakultas teknik memiliki enam jurusan teknik informatika teknik industri manaajemen informatika mekatronika multi media jaringan teknik elektro banyaknya jurusan teknik menimbulkan kesulitan pendataan mahasiswanya lulus alumni mahasiswa teknik disebabkan sistem mendata alumni fakultas teknik sistem pendataan alumni mahasiswa fakultas teknik lulus terjalin tali silaturrahmi fakultas teknik mahasiswa lulus mahasiswa berangkat permasalahan diatas peneliti mencoba merancang sistem pendataan alumni berbasis framework codeigniter system pendataan alumni teknik peranan mempererat tali silaturrahmi keluarga fakultas teknik universitas trunojoyo madura berbagi informasi lapangan pekerjaan informasi berkaitan pendidikan melanjutkan tingkat magister sistem dirancang implementasikan diperoleh kesimpulan hasil respon aplikasi sistem informasi pendataan alumni berbasis web kuisioner admin alumni respon positif presentasi total respons admin alumni,0.1596266225257581,0.0011162704792414524,0.0011162684052425551,0.0011163400625812986,0.8359081174348667,0.0011163810923098998,RPL,2
konsuil lembaga non profit bergerak dibidang keselamatan instalasi listrik proses penentuan kelayakan instalasi berdasarkan kriteria resistansi pembumian tataletak titik beba gambar perkawatan denah bangunan simbol pelengkap memudahkan penentian instalasi layak pakai butuhkan sistem pendukung keputusan metode pakai sistem saw metode saw simple additive weighting salah metode tang sistem pendukung keputusan konsep dasar metode saw mencari penjumlaan terbobot ranting kinerja alternatif atribut hasil uji coba tingkat kecocokan hasil seleksi metode saw sistem dijadikan bahan pertimbangan penentuan kelulusan instalasi listrik,0.0015726235188359037,0.0015723764298167832,0.9921370686349268,0.0015724512737239405,0.0015728965326918156,0.001572583610004773,RPL,0
siswa lulusan smp mengikuti ujian masuk sma patut disayangkan matangnya memilih jurusan sekolah menengah dituju situasi berdampak biaya pendidikan terlanjur dikeluarkan orang tua siswa pemerintah mensubsidi sekolah bermanfaat siswa memiliki kemampuan memadai jurusan dipilihnya berdasarkan informasi diperoleh tim panitia penjurusan jurusan sma negeri kamal jurusan jurusan ilmu pengetahuan alam ipa ilmu pengetahuan sosial ips penjurusan didasarkan pilihan siswa pendaftaran mencatumkan minat jurusan jurusan penjurusan ditentukan nilai disyaratkan masingmasing jurusan sistem pendukung keputusan pemilihan jurusan metode simple additive weighting saw diharapkan membantu tim panitia penjurusan siswa menentukan jurusan siswa mudah menentukan jurusan cocok siswasiswi menggunkan nilai perangkingan lokasi data diolah menentukan jurusan masingmasing siswa kunci jurusan sistem pendukkung keputusan simple additive weighting,0.003067676667270494,0.003067778773247053,0.0030686402577308433,0.9846588883072296,0.0030684858166949514,0.0030685301778272706,KOMPUTASI,1
kartu indonesia pintar salah program pemerintah mengatasi pendidikan indonesia khusunya keluarga miskin rentan miskin menyekolahkan anakanak menikmati mengenyam pendidikan gratis data pembagian kartu indonesia pintar kip data bantuan siswa miskin bsmsmp negeri torjunmerupakan salah contoh sekolah menjalalankan program bsm tersebutnamun pengolahan data bsm sekolah dilakakukan manual penerima bsm sasaranoleh itupeneliti mencoba membangun sistem pendukung keputusan penerima kartu indonesia pintar kip metode nave bayespada penelitian metode adalahnave bayes metode sederhana mudah diimplementasikan komputasi cepat tingkat akurasinya tinggidalam penentuan penentuan penerima kartu indonesia pintar inidigunakan metode pengolahan data berbentuk kategori data data training data testing sebanayak data siswa hasil pengujian disimpulkan perhitungan presentase tingkat akurasi model pengolahan data mencapai nilai presentase akurasi error rate kunci bantuan siswa miskin bsm kartu indonesia pintar kip nave bayes smp negeri torjun sistem pendukungkeputusan spk,0.0010571836319465244,0.0010571524638891547,0.0010572458414104665,0.0010571834332904937,0.9947138934010619,0.001057341228401452,RPL,2
penerimaan siswa salah proses sekolah menjaring calon siswa proses penerimaan siswa memiliki jalur pendaftaran pmdk prestasi akademik nonakademik jalur nilai ujian nasional un sistem informasi berbasis web kemudahan panitia penerimaan siswa pengolahan data nilai memenuhi kriteria masuk smp negeri kamal efisiensi terjamin meningkatkan mutu smp negeri kamal calon siswa mendaftar jalur pmdk prestasi akademik nonakademik proses seleksi metodologi pengembangan sistem informasi metode simple additive weighting saw metode penerimaan penyeleksian siswa berdasarkan kriteria kriteria ditentukan metode saw kunci sistem informasi penerimaan siswa penyeleksian metode simple additive weighting saw,0.0010461976131707768,0.0010461389489089135,0.0010464949016059878,0.0010462532775799142,0.9947687585668348,0.001046156691899698,RPL,2
banyaknya calon nasabah mengajukan kredit kondisi ekonomi berbedabeda menuntut kejelian bank pemberi kredit pengambilan keputusan pemberian kredit penentuan kelayakan kredit nasabah bank bank tabungan negara btn cabangbangkalanperlu memperhatikan prinsip faktorfaktor faktorfaktor dasar pengambilan keputusan bank menentukan calon penerima kredit pekerjaan penghasilan tanggungan status ttempat tinggal permasalahan solusi pemecahan sistem pendukung keputusan bertujuan membantu proses pengambilan keputusan meningkatkan kemampuan memutuskan metode sistem pendukung keputusan nave bayes nave bayes memegangasumsiakan hubungan antarfitur atributnya independen menjadikannya sederhana efisien penerapan naive bayes diharapkan menilai akurasi menentukan nilai kelayakan kredit penerapan metode naive bayes kedalam sistem pendukung keputusan pengajuan kredit bank btn memperoleh akurasi error sistem metodenaive bayes menentukan keputusan pemohon akurasi,0.001116166186083641,0.0011161721769775417,0.0011163067250418563,0.0011161807789078222,0.994418998932354,0.0011161752006352984,KOMPUTASI,2
terpilihnya presiden republik indonesia kebijakan dilakukannya bersamaan pro kontra bermunculan dikalangan masyarakat pendapat muncul konteks positif negatif pendapat bersifat netral proses mengumpulkan pendapat masyarakat tersebar dunia jejaring sosial twitter proses crawling data berhasil dicrawl proses metode nb metode pendapat dikelompokkan berdasarkan kelas ditentukan positif negatif ditampilkan bentuk persebaran peta digital sebaran pendapatpendapat didasarkan daerahnya dibutuhkan aplikasi menghimpun pendapat masyarakat penghitungan metode nave bayes tujuannya tingkat keakuratan pengklasifikasian data menampilkan hasilnya bentuk sebaran peta digital diharapkan aplikasi menjadikannya salah referensi sebaran pendapat kunci crawling twitter klasifikasi nave bayes peta digital,0.5461151906864203,0.0008434408012837574,0.45051151481067414,0.0008433070342217462,0.0008432817932149152,0.0008432648741850691,RPL,1
pengukuran penilaian kinerja evaluasi perancangan meningkatkan pelayanan rumah sakit syamrabu bangkalan penilaian prestasi karyawan mutlak prestasi dicapai karyawan kinerja dibutuhkan sistem keputusan penilaian kinerja menelakukan penilaian kinerja karyawan membutuhkan metode hasil pembobotan alternatif penelitian diangkat mencari alternatif terbaik berdasarkan kriteriakriteria ditentukan metode simple additive weighting saw penelitian mencari nilai bobot atribut proses perankingan menentukan alternatif optimal keyword sistem pendukung keputusan kinerja karyawan saw,0.0008362332836153357,0.0008363231325946303,0.9958186972318386,0.0008362158379956603,0.0008363310524401597,0.0008361994615156069,KOMPUTASI,0
abstrak system manajemen pergudangan pt aka jaya penanganan integritas penerimaan barang masuk barang ptaka jaya system manual kemajuan teknologi pesat disayangkan ptaka jaya menerus system manual pemaparan melatar belakangi peneliti mengembangkan sytem,0.0008804276819511983,0.000880331601545578,0.995598102427925,0.0008803452463121563,0.0008804101292963579,0.0008803829129696847,RPL,0
perusahaan bergerak olahan cokelat merabah dikalangan pengusaha memudahkan konsumen berfariasi sesuai selera konsumenakantetapi pesaing meningkatkan resiko kegagalan persaingan perdagangan hasil pengamatan mayoritas pengusaha memperhatikan kuat perusahaan miliki salah utuk sehat perusahaan merujuk pendataan inventaris miliki penelitian bertujuan sistem informasi memudahkan usahawan olahan cokelat berkembang memudahhan mendata inventaris miliki sistem kemudahan pencatataan pengelompokan barang dicatat berdasarkan kategori nama barang keterangan satuan barang barang tersedia kategori barang memiliki keterangan tersendiri memudahkan admin mengatur pendataan inventaris hasil penelitian membantu pendataan inventaris terbukti hasil ujicoba admin pimpinan perusahaan benua cokelat penilayan memuaskan kunci inventaris mayoritas admin sistem informasi,0.0009653977150239883,0.0009652978604443511,0.0009654334406394218,0.6608887319189367,0.33524967724787524,0.0009654618170803258,RPL,2
organisasi sekumpulan orang orang terkumpul wadah visi misi tercapainya visi misi organisasi tergantung anggota anggotanya salah organisasi kemahasiswaan ukm unit kegiatan mahasiswa perguruan negeri swasta permasalahan system keanggotaan kerap salah satuf actor kerancuan informasi organisasi salah contoh proses manajemen keanggotaan organisasi ukm anggotanya berasal jurusan berbeda semester berbeda mengatasi diatas organisasi cermat memanajemen keanggotaan ukm proses manajemen bias berjalan efektif efisisen penelitian penelitiakan merancang sistem mengatur manajemen keangotaan organisasi ukm unit kegiatan mahasiswa creative computer club hasil respon aplikasi sistem informasi pendataan anggota berbasis web kuisioner admin anggota respon positif presentasi total respons admin anggota,0.0008805443689861813,0.000880385064330341,0.2031036004534066,0.0008803781725152781,0.7933746764427124,0.0008804154980491412,RPL,2
