Dokumen,Topik 1,Topik 2,Topik 3,Topik 4,Topik 5,Topik 6,Label,Cluster
ukm usaha menengah kegiatan ekonomi perseorangan rumah tangga badan bertujuan memproduksi barang jasa diperniagakan komersial dibawah pengawasan dinas pemerintah membantu ukm pemasaran penjualan sistem penjualan online berbasis ecommerce mencatat transaksi penjualan menghasilkan informasiinformasi dibutuhkan sistem diakses dimanapun menghasilkan informasi penjualan otomatis dibutuhkan pemusatan data data center wadah mendukung keefektifan sistem pengolahaan pengadministrasian data data center media pemusatan data penghubung akses ukm dinas pemerintah pendistribusian data informasi mendukung pengembangan konsep data center sistem terdistribusi data center masingmasing ukm sistem terdistribusi memiliki keuntungan meliputi pengawasan distribusi reability availability kecepatan pemprosesan query dimplementasikan pembangunan data center sistem terdistribusi dinas pemerintah menaungi ukm membantu informasi terbaru informasi perubahan data penjualan produk ukm,0.15270150703614382,0.0011683650143851244,0.2634415233893502,0.0011683011007410315,0.43040613221978496,0.15111417123959478,RPL,2
industri menengah ikm salah bentuk usaha menengah ukm membantu pertumbuhan ekonomi nasional regional ketatnya persaingan pasar banyaknya ikm mempengaruhi tingkat pemasaran memanfaatkan penggunaan ti ikm membantu memperluas tingkat pemasaran penggunaan ti salah akses ikm mengembangkan usahanya peran ti ikm memasuki era informasi pemanfaatan penggunaan ti ikm kabupaten bangkalan dimanfaatkan minimnya pengetahuan penggunaan ti penelitian pengelompokan clustering metode data mining membagi data kedalam kelompokkelompok objek karakteristiknya penggunaan tingkat ti ikm pengelompokan berdasarkan kriteria ti metode kmedoid distance measure manhattan euclidean canberra distance memvalidasi data proses clustering davies bouldin index dbi nilai dbi kualitas cluster,0.0009383111490785483,0.0009381895123924498,0.5713264622556846,0.000938203675147108,0.4249205927522329,0.0009382406554643471,RPL,0
pengetahuan minimnya pola pelestarian bahasa madura menyebabkan bahasa terjaga kelestarianya proses globalisassi urbanisasi berpotensi memicu asimilasi akulturasi budaya didaerah perkotaan memicu terbentuknya bahasa bahasa gaul disukai kalangan pemuda munculnya sekolah nasional internasional mewajibkan siswa berkomunikasi bahasa asing pola pembelajaran efektif bahasa madura terjaga kelestariannya salah satunya aplikasi penerjemah bahasa indonesia bahasa madura metode rule based aplikasi salah penyebaran pengenalan bahasa madura masyarakat madura bahasa madura terjaga kelestariannya aplikasi penerjemah menerjemahkan bahasa indonesia bahasa madura kunci kamus lengkap bahasa madura enhanced confix stripping stemmer rule based,0.9957113647932054,0.0008577200849222519,0.0008577264957183138,0.0008576928419708541,0.0008577919216665897,0.0008577038625164743,RPL,1
vlan memecah jaringan jaringan segmen tujuan vlan memperkecil traffic broadcast masingmasing subnet vlan mengatasi kekurangan lan penggunaan alatalat jaringan efisien mode vlan salah satunya mode trunking dimana mode trunk kecepatan sd mbps mode trunk menghubungkan bebrapa vlan berbeda konsep vlan trunking masyarakat perusahaan tugas analisis quality of service jaringan lan vlan trunking lab terpadu utm hasil analisis diperoleh jaringan vlan trunking unggul jaringan lan paramter delay jitter nilai delay jitternya cenderung jaringan vlan trunking trhoughput jaringan lan unggul jaingan vlan jaringan terbebani trafik dibuktikan trafik jaringan ditambah jaringan vlan trunking unggul lan packet loss skala jaringan diukur skala paket loss,0.6519080899035031,0.0008433592048469832,0.34471837624153945,0.0008433513630530671,0.0008434192783451344,0.0008434040087122386,RPL,1
smartphone barang mewah masyarakat indonesia smartphone menikmati hiburan aplikasi pemutar musik buku elektronik internet game permainan aplikasi populer game game media hiburan murah menarik anakanak beragam jenis game tampilan tingkat kesulitan menantang game aplikasi digemari kalangan pengguna smartphone tugas ta dibangun game android mobile penelitian diciptakan game bernama gasing gampang aisk menyenangkan teknologi speech recognition pengucapan suara bertujuan mempermudah memotivasi belajar matematika matematika dianggap pelajaran sulit rumit membosankan kebanyakan peserta didik pemahaman salah mengakibatkan anakanak enggan mempelajari matematika game dibangun mode permainan single player multiplayer maksimal pemain mode single player pemain melawan sistem tersedia level kesulitan berbedabeda mode multiplayer pemain melawan pemain bluetooth media perantaranya inti game pemain matematika pengucapan angka bahasa indonesia,0.9959542815290351,0.0008091234633833479,0.0008092002668282159,0.0008090944806891415,0.0008091517741271678,0.0008091484859371582,RPL,1
pelayanan guru siswa terkait walikelas bidang kurikulum pengumpulan penilaian semester tahunan bersifat manual lambat solusi aplikasi web sistem akademik sekolah dibangun mengatasi permasalahan dihadapi segenap stakeholder sekolah aplikasi website kurikulumwali kelas guru menyelesaikan penyerahan nilai raport siswa membatasi aktivitas guru tugasnya pengumpulan nilai siswasiswi kunci website stakeholder sistem akademik sekolah kurikulum,0.9956740519347176,0.0008651018452738946,0.0008652623890060267,0.0008651974523628791,0.0008651833750983246,0.0008652030035413242,RPL,1
informasi beasiswa internet sisi memunculkan kesulitan pencari beasiswa informasi beasiswa konsep sistem pencarian berbasis information retrieval ir proses mencari informasi beasiswa media internet pembangunan ir penelitian konsep vector space model vsm pengumpulkan data informasi beasiswa web crawler hasil proses crawling disimpan basis data aplikasi web crawler web crawler vietspider kesamaan data beasiswa diintegrasikan cosine similarity cosine similarity membentuk data beasiswa relevan dibutuhkan user berdasarkan query dimasukkan berdasarkan hasil pengujian sistem didapatkan nilai minimal cosine similarity threshold ratarata presentase nilai fmeasure tingkat efisiensi kinerja sistem mencapai,0.9960501834957869,0.0007899445948170796,0.0007899651930843682,0.0007899332299505309,0.0007899765886446922,0.0007899968977163895,RPL,1
berkembang perusahaan dibutuhkan kebutuhan tenaga manusiayang produktif perusahaan kinerja terbaik berinteraksi terkait salah satunya konsumen mewujudkan perusahaan mencari sumber daya manusia melaksanakan pekerjaannya penyeleksian penilaian kerja manual kriteria human resource development banyaknya kriteria karyawan dipekerjakan menyulitkan divisi hrd penyeleksian karyawan terbaik seringkali pengambil keputusan dinilai subyektif hubungan pelamar pengambil keputusan kualitas kerja karyawan seringkali berubahubah berpengaruh prospek perusahaan kedepannya kesibukan manager tatap muka karyawan pengawasan kinerja karyawan sulit sisstem pendukung keputusan penilaian kinerja karyawan sistem algoritma c teknik data mining pohon keputusan algoritma memasukkan data training simpul akar pohon keputusan data training sampel membangun model classifier pohon keputusan proses monitoring karyawan dipantau penentuan kenaikan gaji promosi jabatan,0.9956743698860145,0.0008650871792803764,0.000865105795546606,0.0008650874306941024,0.0008651178217472553,0.000865231886717166,RPL,1
pengenalan ekspresi wajah pengembangan pengenalan wajah lingkungan pengenalan pola feature recognition penelitian pengenalan ekspresi wajah bermanfaat bidang contohnya bidang interaksi manusia komputer komputer mengenali ekspresi wajah pengguna komputer terprogram intruksi sesuai ekspresi wajah pengguna penelitian database jaffe japanese female facial expression ekspresi wanita jepang masingmasing ekspresi pose ukuran dimensi citra x piksel penelitian bertujuan membangun sistem pengenalan ekspresi wajah metode ekstraksi fitur two dimensional linear discriminant analysis modification modifikasi dlda hasil pengembangan metode two dimensional linear discriminant analysis dlda dlda pengembangan metode linear discriminant analysis lda pengukuran kemiripan metode two dimensional correlation coefficient mengalikan bobot training bobot testing membaginya hasil akar bobot training dikalikan bobot testing hasil uji coba tingkat akurasi tertinggi skenario tingkat akurasi terendah skenario,0.001241175894504071,0.00124092015577197,0.7364493685847953,0.0012407767203349252,0.001240984563186157,0.2585867740814077,RPL,0
sistem parkir berlaku kebanyakan bersifat pencatat manual memasuki area perparkiran karcis parkir tanda bukti sistem memiliki kekurangan tingkat kebenaran pencatat nomor kendaraan human error mempengaruhi proses pelayanan sistem perparkiran penelitian sistem bi sa mendeteksi lokasi plat nomor operasi morfologi salah metode memfokuskan pengolahan bentuk segmen citra berdasarkan penelitian tugas sistem pendeteksi lokasi plat nomor menggunnakan operasi morfologi mengunakan fungsi dilasi menebalkan citra erosi menipiskan citra opening membuang obyek dianggap noise langkah menjalankan sistem input citra diproses tahapan preprocessing seleksi obyek plat nomor verifikasi posisi plat nomor output ditampilkan lokasi posisi plat nomor kendaraan ditandai dangan area persegi input citra berdasarkan hasil uji coba skenario hasil terbaik skenario ketiga label disk menghasilkan pendeteksian posisi plat nomor sukses error terdeteksi,0.0007542469601893447,0.18615756722599505,0.0007545345907161579,0.8108251363996037,0.000754288563946326,0.0007542262595493535,KOMPUTASI,1
pengenalan karakter pengenalan pola berbentuk karakter huruf angka permasalahan muncul proses pengenalan karakter tulisan metode pengenalan mengenali karakter tulisancitra tulisan disimpan citra diolah mengenali karakter huruf angka citra tulisan penelitian bertujuan mengimplementasikan metode learning vector quantization pengenalan teks multi line proses mengenali teks multi line tahap preprocessing pelatihan pengenalan metode learning vector quantization tahap preprocessing binerisasi penghapusan noise segmentasi profile projection normalisasi tahap preprocessing memudahkan pelatihan citra tulisan hasil tahap preprocessing citra karakter citra tulisan tahap tahap pelatihan pengenalan tahap metode learning vector quantization mengelompokkan karakter berdasarkan kelas masingmasing diperoleh bobot pengenalan karakter data uji dihitung jarak minimum bobot euclidean distance data uji karakter dimasukkan masingmasing kelas berdasarkan jarak minimum percobaan pengenalan karakter metode learning vector quantization mengenali citra berisi citra dilatih ratarata,0.9882778766341228,0.0007658773182908288,0.0007657652475558655,0.0007657752886515237,0.008658822997307287,0.0007658825140719456,RPL,1
teknologi pengenalan karakter salah teknologi bermanfaat membantu manusia pekerjaan proses digitalisasi penelitian pengenalan citra karakter penelitian tugas menerapkan metode template matching correlation pengenalan karakter baris multi line tahapan utama tahap preprocessing segmentasi pengenalan karakter tahap preprocessing tahap merubah citra biner menghilangkan noise tahap segmentasi profil proyeksi segmentasi profil proyeksi proses pemotongan baris kolom citra karakter hasil citra karakter uji template disamakan ukuran diproses tahap tahap ketiga pengenalan karakter metode template matching correlation menghitung kedekatan karakter citra template citra uji kerja metode template matching correlation mencocokkan piksel matrik citra uji citra template acuan nilai maksimum nilai maksimum dijadikan hasil pengenalan karakter tulisan pengujian citra variasi baris kalimat akurasi didapatkan pengujian karakter dikenali metode template matching correlation,0.0008577708152349917,0.3367564359048319,0.659812379660634,0.0008577571807870285,0.000857879439301597,0.0008577769992105132,KOMPUTASI,0
teknologi dunia kedokteran berkembang memudahkan mendeteksi penyakit manusia penyakit diabetes penyakit diabetes menyebabkan permasalahan mata diabetic retinopathy mendeteksi penyakit tahap segmentasi pembuluh darah penelitian menerapkan laplacian of gaussian metode segmentasi terbagi proses utama preprocessing segmentasi perbaikan citra proses segmentasi tahap preprocessing mengambil citra green channel memperbaiki kontras citra contrast limited adaptive histogram equalization clahe tahap segmentasi laplacian of gaussian laplacian of gaussian parameter koordinat xy variansi hasil laplacian of gaussian matrik mask mengkonvolusi citra tahap ketiga proses noise removal overlapping mask operasi morfologi dilasi field of view removal hasilnya dibandingkan citra groundtruth menghitung tingkat akurasi pengujian database digital retinal images for vessel extraction drive citra hasil citra segmentasi dibandingkan citra groundtruth akurasi hasil terbaik akurasi terendah ratarata akurasi citra dihasilkan segmentasi metode laplacian of gaussian segmentasi,0.0012565936944623404,0.6687943210817552,0.0012565575764910844,0.0012564038196553888,0.0012565642158412502,0.3261795596117948,KOMPUTASI,1
diabetic retinopathy salah gangguan mata akibat penyakit diabetes penanganan gejala mengakibatkan kebutaan diabetic retinopathy ditandai kerusakan pembuluh darah retina mengalami kebocoran menimbulkan penumpukan cairan gejala penyakit pengecekkan mata penyakit cairan exudates mengecek penyakit ekstraksi pembuluh retina penelitian segmentasi pembuluh darah retina metode tahap proses segmentasi fundus mata tahap preprocessing menghilangkan noise dgaussian low pass filtering dglpf meningkatkan kualitas penajaman citra adaptive histogram equalization ahe tahap segmentasi transformasi bottomhat menghapus tepi retina mask overlapping perhitungan tingkat akurasi citra hasil segmentasi citra ground thruth pengujian database digital retinal images for vessel extraction drive citra metode matrik mask overlapping mensegmentasi dibuktikan hasil akurasi segmentasi dibandingkan citra ground truth kunci segmentasi matrik mask overlapping dgaussian low pass filtering dglpf,0.0008505727625818196,0.0008503733594211658,0.0008506762325550396,0.0008504024014846212,0.995747551566777,0.0008504236771803762,RPL,2
sistem clustering metode cluterisasi salah satunya som self organizing maps penelitian pendekatan pendekatan pengclusteran somrbf pelatihan data diduga menghasilkan cluster pendekatan pengclusteran som perbandingan metode didasarkan penerapan data berasal dataset situs movielensorg penilaian perbandingan skenario mse kondisi stop running time mse kondisi stop epoch learning rate mse kondisi stop nilai mse dimana running time terdeteksi pendekatan manakah cepat rentang mengekstraksi data latih berdasarkan hasil uji coba data diterapkan cluster menghasilkan kesimpulan pendekatan nilai mse mendekati nilai absolut mse dibandingkan pendekatan,0.0008727382506821411,0.0008727322620995233,0.7181370876656653,0.0008727293701668678,0.21688213198677292,0.06236258046461325,RPL,0
madura pulau indonesia lepas pantai timur laut jawa dikenal pulau memiliki kekayaan budaya beragam bernilai salah budaya madura terkenal manca negara karapan sapi kerapan sapi perlombaan pacuan sepasang sapi menarik kereta kayu joki berdiri mengendalikan jalan sapi cepat diiringi lagu madura saronen sapi berlari energik dikendalikan joki memecut sapi karapan seiring berkembangnya teknologi diciptakan game mengangkat budaya madura karapan sapi game dibangun menyerupai game subway surfers genre arcade and action grafis dimensi dimana pemain sapi karapan menghindari kejaran sakera pengembangan didukung metode finite state machine fsm membantu pemilihan keputusan bergerak karakter sapi pemecahan behaviour kebiasaan aturan main objek berdasarkan state memiliki aturan masingmasing merubah state state perancangan game bertujuan mengenalkan karapan sapi budaya madura manca negara inovasi game bertujuan menghibur pemain variasi hiburan skenario tampilan grafis menarik kunci kerapan sapi game fsm,0.00124095227818909,0.0012408982634592477,0.0012410690088833813,0.001240921769068674,0.9937949763116003,0.001241182368799208,RPL,2
panca indra manusia rentan penyakit indra pengelihatan mata penyakit teridentifikasi organ mata salah satunya penyakit mata diabetes diabetic retinopathy dr indikasi penyakit diabetic retinopathy dr ketidaknormalan mata ditandai gangguan kerusakan pembuluh darah kapiler jaringan berfungsi sensor cahaya retina pendeteksian tindakan perawatan sesuai identifikasi ketidaknormalan pembuluh darah segmentasi langkah memudahkan penelitian karakteristik pembuluh darah retina penyediaan pemetaan penelitian tugas segmentasi pembuluh darah retina tahap preprocessing segmentasi tahap preprocessing citra mengambil citra rgb red green blue green channel memperbaiki kontras citra contrast limited histogram equalization clahe menghilangkan noise median filter tahap segmentasi citra morphological skeleton citra pruning citra dilasi perhitungan tingkat akurasi ground truthnya pengujian database drive digital retinal image for vessel extraction citra metode skeleton prunning mensegmentasi dibuktikan hasil akurasi segmentasi dibandingkan citra ground truth kunci segmentasi pembuluh darah retina sekeleton,0.0009843581364536646,0.5693581039938277,0.0009843845565797238,0.0009844480345142833,0.42670432494216437,0.0009843803364603953,KOMPUTASI,2
elearning diterima masyarakat dunia terbukti maraknya implementasi elearning lembaga pendidikan industri elearning jenis sistem pembelajaran sampainya bahan ajar siswa media internet media jaringan komputer tes adaptif sistem ujian otomatis adaptif menyesuaikan tingkat kesulitan kemampuan masingmasing peserta ujian tergantung salah hasilnya level tingkat kemampuan peserta ujian salah metode tes adaptif model fuzzy item response theory firt diimplementasikan pembuatan aplikasi tes adaptif lingkungan pendidikan berdasarkan hasil eksperimen disimpulkan adaptive test dikembangkan menerapkan fuzzy item response theory menempatkan siswa tingkat kemampuan sesuai kemampuannya nilai siswa meningkat adaptive test dibandingkan konvensional test dibuktikan uji coba hasil ratarata nilai siswa nilai siswa adaptive test hasilnya meningkat dibandingkan nilai siswa konvensional test ratarata nilai siswa adaptive test ratarata nilai siswa konvensional test,0.0011548769458467458,0.35451263688566437,0.0011549452521114393,0.0011548675234121907,0.6408677423644183,0.0011549310285468197,KOMPUTASI,2
kesehatan gigi manusia orang memiliki pergi dokter gigi rangka pencegahan penyakit gigi kronis akibatnya orang dokter gigi giginya rusak parah menangani permasalahan efisien membangun aplikasi konsultasi konvensional pasien bertambah kedepannya metode penelitian deteksi kemiripan bantuan metode winnowing didukung synonym replacement penyusunan faq penerapannya menjadikan konsultasi mudah uji coba menguji jenis synonym replacement ujicoba synonym replacement versi terbaik membantu pendeteksian peningkatan angka deteksi dibandingkan synonym replacement merubah konstanta algoritma winnowing konstanta prime ngram nwindow terbaik deteksi kalimat angka deteksi mencapai,0.0009843663168956865,0.0009844949717658761,0.05518436446619711,0.0009843302199538037,0.9408780980199811,0.0009843460052063374,KOMPUTASI,2
tingkat persaingan global kompetitif ukm sistem pengukuran kinerja diukur periodik terarah sistem perkembangan ukm mengukur kinerja ukm ukm metode penilaian kinerja perusahaan financial perspective penelitian peneliti metode balance scorecard metode pengembangan pengukuran kinerja tradisional pengukuran ukur perspektif keuangan metode balance scorecard perspektif perspektif keuangan perspektif pelanggan perspektif proses bisnis internal perspektif pertumbuhan pembelajaran penelitian analytical hierarchy process ahp sistem pendukung keputusan metode merepresentasikan permasalahan kompleks kedalam struktur multi level hirarki penelitian perusahaan objek penelitian usaha menengah ukm daerah bangkalan ukm nusa indah ukm hmfhjunyil ukm almadani hasil penelitian diperoleh tingkat kinerja dominan ukm nusa indah nilai kinerja tingkat kinerja ukm lemah ukm almadani nilai kinerja kunci sistem pengukuran kinerja usaha menengah ukm balance scorecard analytical hierarchy process,0.6852665244704966,0.0012409568832151975,0.0012411358305400748,0.0012408500909244793,0.30976949324618525,0.0012410394786382846,RPL,1
sistem ujian konvensional kegiatan akademik kali menemui kendala faktor penilaian kecurangan kendala ditemui seiring berkembangnya teknologi informasi ujian konvensional bergeser sistem ujian online ujian online ujian alat bantu komputer tujuan pembuatan sistem ujian online memudahkan guru mengoreksi ujian mengefisiensi hasil ujian objektif sistem ujian online memudahkan guru soalsoal ujian siswanya menghasilkan nilai cepat mudah penilaian ujian efektif efisien sistem otomatis sistem ujian online mengurangi biaya penyediaan bahan ujian sistem ujian online membantu mengurangi penggunaan kertas mencetak ujian sistem tingkat pengguna administrator guru siswa jenis pilihan ganda ganda benarsalah sistem tampil acak meminimalisir tingkat kecurangan siswa ujian sistem ujian online membantu proses pengolahan data ujian data nilai siswa kunci computer based tes ujian ujian online,0.5039574536984188,0.0010042559477940964,0.1870895970342355,0.001004201125839184,0.3059403055585783,0.00100418663513416,RPL,1
pemerintah daerah pengelola pendidikan informasi kondisi pendidikan wilayahnya perencanaan kebijakan sesuai perluasan pemerataan pendidikan pengetahuan informasi pemerataan pendidikan pengelompokan kecamatan berdasarkan indikator pemerataan pendidikan pengelompokan clustering salah metode data mining membagi data kelompok kelompok objek karakteristiknya salah metode clustering self organizing map som penelitian mengelompokkan kecamatan kabupaten lamongan cluster variabel indikator pemerataan pendidikan uji coba iterasi masingmasing learning rate skenario menghasilkan anggota cluster analisis cluster berbedabeda dipengaruhi nilai iterasi nilai random kunci clustering indikator pemerataan pendidikan self organizing map som,0.0008651704794747719,0.0008651608037696033,0.0008651793614374227,0.42937068174025433,0.5671686673937194,0.0008651402213445583,RPL,2
keamanan jaringan komputer salah perkembangan teknologi dampak keamanan jaringan komputer maraknya penyusupan jaringan komputer mengancam data akibat ulah orang bertanggung menjaga kerahasiaan keaslian ketersediaan data sistem mendeteksi penyusupan jaringan komputer berjalan real time intrusion prevention system ips sistem memonitor jaringan tindakan jaringan komputer ips perkembangan ids dimana ips suricata pendeteksi penyusup dikoneksikan iptables pencegah penyusupan ips dilengkapi tampilan gui memudahkan admin memantau jaringan tindakan penyusupan server suricata alert terdeteksi penyusupan jaringan disimpan file log suricata webadmin menampilkan dialog alert disertai bunyi alarm memerintahkan iptables memblokir alamat ip teridentifikasi penyusup akses penyerang server terputus berdasarkan percobaan kali suricata iptables optimal mendeteksi serangan,0.0007963537524169353,0.0007962692005838561,0.23209383879602744,0.7647208293375773,0.0007963802855856916,0.0007963286278086841,RPL,1
data elektronik salah jenis data populer orang mengaksesnya jaringan internet data elektronik pertukarannya dimanfaatkan berdampak positif memanfaatkannya pertukaran data elektronik electronic data interchange edi cocok diterapkan ukm usaha menengah mempromosikan mencatat data produknya pastinya meningkatkan kualitas popularitas usahanya rest representational state transfer salah metode sesuai menerapkan electronic data interchange edi memiliki tugas utama pertukaran data server media promosi pemilik ukm usaha menengah penelitian menghasilkan media promosi online usaha menengah ukm memanfaatkannya promosi produk media promosi usaha menengah berkembang bersaing usaha maju mempromosikan produknya media promosi online,0.0014166886288943968,0.0014165876307433512,0.0014168038657283708,0.0014165268548726932,0.9929166493641381,0.0014167436556229397,RPL,2
elearning sistem belajar mengajar metode materi pembelajaran kegiatan belajar sistem terhubung internet kegiatan belajar mengajar sekolah mempelajari materi latihan ujian post test pembuatan skripsi bertujuan merancang membangun aplikasi simulasi toefl berbasis android eclipse sqlite database toefl test of english as a foreign language memiliki jenis listening structure reading kebanyakan toefl manual pengerjaan kertas membutuhkan hasil tes artikel didapatkan sistem adaptif menganalisis kelemahan user kelemahan sistem tes pretest posttest pretest latihan toefl posttest toefl sesungguhnya pretest latihan sistem menganalisis kelemahan user berdasarkan nilai tes section pengguna memonitor nilai didapatkan pretest aplikasi diharapkan kemudahan pengguna latihan tes toefl kunci eclipse sqlite android tes toefl,0.0012108315710215526,0.04586690481863324,0.9492895874519086,0.0012108131624548985,0.0012110309637418802,0.0012108320322398386,KOMPUTASI,0
olahraga salah aktivitas fisik menyehatkan tubuh olahraga keuntungan tubuh tubuh sehat mengidap penyakit faktor malas berolahraga alasannnya bermacammacam berpikir lelah melakukannya berolahraga membakar kalori berolahraga membakar kalori berolahraga aktivitas seharihari hobi alternatif membakar kalori sadar aktifitas seharihari membakar kalori aplikasi dibangun platform android bahasa pemrograman java media penyimpannya sqlite aplikasi burn calory rumus menghitung pembakaran kalori mets pendekatan pengukuran menentukan tingkat aktivitas fisik penelitian diperoleh kesimpulan rumus menghitung pembakaran kalori diterapkan aplikasi burn calory kunci burn calory android smartphone mets,0.0009750475378673204,0.0009747627813565318,0.9951258338843358,0.0009746955456022311,0.0009747961045925034,0.000974864146245624,RPL,0
